,title,contents
2501, 크루즈 트로피 반납 미나리 홀대 골든글로브 존폐 위기 ,골든글로브 시상식 트로피 영화 러팔로 맥과 맥그놀리아 워너브러더스 할리우드외신협회 남우조연상 무감각 어벤저스 헐크 개혁안 행사 거물 보이콧 인종적 혐오적 
2502, 트럼프 며느리 경호원 부적절 관계 ,요원 티파니 비밀경호국 경호원 트럼프 르닉 과체중 경호 며느리 대통령 가디언 반복적 감정 관계 
2503, 눈수술 일만 운전 엄마 참변 ,조사 이상화 교통사고처리특례법상 범퍼 경상 흐릿 치사 수거 음주운전 모녀 블랙박스 경찰 운전 입건 바닥 수술 진술 치료 차량 
2504, 초등생 묻지마 살인범 무기징역 ,재판부 정신과적 등골 정신감정 범행 선고 무기징역형 치료감호 서늘 심신장애 태연 담담 변화도 참혹 원심 기각 양측 항소 정신적 
2505, 수척 마윈 반년만 기념촬영 ,알리바바 마윈 봉황망 당국 본사 중국 알리데 항저우 연례행사 앤트 반독점 사원 행사 대중 재판매 압박 주가 반년만 축제일 
2506, 아내 사망 코흘리개 자녀 확진 증평 가정 비극 ,자녀 증평군 검사 생계 처지 긴급 사망자 구호제도 증평군보건소 확진 겨를 단란 먹고사 불분명한 방안 다각적 산업재해 일용직 주거급여 
2507, 횡단 어머니 차량 ,삼거리 횡단 치료 경찰 가습기 교통사고처리특례법상 바닷물 좌회전 신호등 흐릿 치사 음주운전 모녀 신호 입건 수술 진술 회복 차량 
2508, 게이츠 호색한 유명 전라 수영장 파티 ,멀린다 나체 수영장 게이츠 파티 결혼 라번 엡스타인과 별일 추월 억만장자 염려 성범죄 미성년자 목숨 분명 관계 경제 대한민국 
2509, 유치원 등원 횡단 어머니 차량 ,횡단 교통사고처리특례법상 삼거리 흐릿 치사 결석계 음주운전 출석부 모녀 경찰 신호 입건 수술 진술 국회의원 치료 회복 차량 병원 
2510, 탐정 남성 나체영상 유포 용의 추적 급물살 면접 ,피해자 용의자 남성 경찰 여성 유포 소개팅 리스트 서버 영상 면접 신원 유출 수사 불법 동일범 불법영상 알려지길 위치기반 
2511, 백신 천회분 도착 누적 도입량 천회분 ,물량 화이자 백신 직계약한 천회 구매계약 화물 인천국제공항 항공편 입소 고령층 결석계 출석부 노인 종사 정부 인도 예방 국회의원 
2512, 성매매 강요 거절하자 집단 폭행 여중생 뇌출혈 ,여중생 박성아 성매매 가해자 박주원 위협식 중환자실 오빠 포항 결석계 출석부 강요 옥상 추적 거부 머리 학생 얼굴 국회의원 
2513, 한강 의대생 친구 ,국립과학수사연구원 통지 권남영 수상택시 신변 가족 혐의점 승강장 참고인 수중 악성 개인정보 정밀 한강 협박 사인 부검 실종 공원 
2514, 횡단 엄마 참변 운전자 눈수술 ,삼거리 신호등 횡단 경찰 교통사고처리특례법상 좌회전 흐릿 치사 음주운전 모녀 입건 수술 진술 치료 회복 차량 병원 조사 
2515, 방구석 한강 사건 발끈한 경찰 ,매스컴 방구석 의대생 수사 음모론 담당자 한강 국민 기소 규정 갑갑 날밤 묵히긴 빙의 공개금지 형사팀 한몸 한탄 기약 
2516, 주먹질 분노 유발 ,달성경찰 폭행 김아현 불구속 연루 지장 사실관계 입건 생명 피해자 조사 
2517, 최재형 감사원장 부부 엄마 나왔대 아이 ,원장 입양 진호 아이 정인이 가슴 가정 아동학대 휴대 결혼할래 광영 껌딱지 양육되기 영진 예원 주책 진호한테 야단 장난스레 
2518, 식당 빚쟁이들 바퀴벌레 마리 테러 ,바퀴벌레 식당 이완뉴스 타이베이경찰서장 경찰국 주인 채권자 비닐봉지 구속 제때 남성 생선가게 중산 지하우스 천지아창 해충방제업체 타이베이시 행위 경찰 
2519, 자충수 직위해제 이성윤 ,차장검사 승진 유임 이태훈 검찰 지검장 서울중앙지검장 불이익 전례 문재인 대통령 
2520, 통합 포용 정치 ,고인 회장 빈소 사장 김동관 노제 방상훈 방준오 윤석민 윤세영 정몽규 중한관계 창업회장 친교 미디어 생가 국립대전국립현충원 태영건설 싱하이밍 
2521, 손정민 아버지 명명백백 ,손현 아버지 이럴 손정민 진실 근속휴가 박기완 명명백백 육체적 침착 주검 정민이 장례 심장 장례식 격려 결심 정신적 죽음 
2522, 제주 청산가리 파란선 문어 발견 ,파란선 문어 성체 테트로도톡신 한국수산자원관리공단 맹독 방파제 고재형 절대 무늬 파란색 발견 인계 갤럭시 확진자 대표 대한민국 
2523, 정민씨 공개 아들 ,골든 시험 가수 의대 엄마 강의실 답안 일리 강은영 지칭 발표 단정 별장 김학 경찰 손정민 게임 의문 배우 
2524, 간호사 실수 이탈리아 여성 백신 회분 접종 ,백신 회분 보건당국 접종 이탈리아의약청 임상심리 토스카나주 엄마 보건의료 교육생 사례 이탈리 정량 주입 진상조사 여성 퇴원 별장 이스라엘 
2525, 남산돈까스 원조 공방 건물주 ,남산돈까스 원조 돈까스 빅페이스 간판 남산 설립연도 위탁운영자 건물주 식당 소파 표기 프랜차이즈 반박 운영 본점 주황색 한국식 전문점 
2526, 아내 큰딸 게이츠 가족 ,니퍼 멀린다 게이츠 이혼 가족 어머니 엄마 아버지 자녀들이 큰딸 사회관계망서비스 대변 여행 발표 자녀 결혼 라는글 어버지 온가족 
2527, 미국발 금리 인상 부담 집값 하락 공포 영끌족 ,저소득층 금리 최다원 엄마 김규정 자산승계연구소장 부동산투자자문센터 수도권 우병탁 주택가격 한국투자증권 매수세가 신한은행 외곽 불안정 양극화 별장 김학 차주 
2528, 오빠 권순욱 말기암 고백 몸무게 희망 ,나이 고통 기약 건강관리 오빠 오경묵 확장 치료 병원 
2529, 박신영 아나운서 오토바이 충돌 배달원 사망 ,오토바이 사거리 아나운서 신호 충돌 머리 경찰 레인지로버 유족분 적색 특례법상 차량 직진 황색 좌회전 피해자분 명복 치사 불구속 
2530, 문신한 그들 죽음 중고차 유서 ,중고차 사이트 중고차사이트 신정훈 구매 미끼 경찰 매물 경찰청 신고 국토교통부 자동차 인터넷 차량 관리 
2531, 칼로리 매출 급증 음료 ,롯데칠성음료 주류 탄산음료 판매 칠성 흑자 매출 수제맥주 칼로리 박윤기 생드래프트 음료 출시 전환 제로 성장 분기 환산 시장 
2532, 여친 스토킹 남성 극단 선택 ,자살예방 상담 국민청원글 의율한 차창희 폭행죄 극단 용이 수사 상해 스토킹 친형 핫라인 폐쇄회로 우울감 동생 목격자 신고 청소년 
2533, 대한민국 위탁생산 싱가포르 백신기 ,백신 기술 개발 바이오 기업 김시균 이전되느냐 생산 이승규 업체 이유진 전폭적 중국 니즈 진척 녹십자 삼성바이오로직스 테크 설비 
2534, 로봇 조원 시장 도전나선 ,로봇 대기업 배달 성장 로봇팔 롸버트치킨만 백주부 벤처캐피털리스트 우수민 위벤처스 후추후추 심사역 팩토리 후추 어쩌다 더본 시그니처 개발 시장조사 
2535, 경찰 박신영 교통사망사고 양측 과속 여부 분석 의뢰 ,오토바이 유족분 직진 조사 사거리 명복 과실 고인 운전 충돌 소속사 상위 사고 닥터지바 멘사 스포츠매거진 스포츠아나운서 호기심팩토리 황색신호 
2536, 등산 아웃도어 전성기 ,아웃도어 디스커버리 노스페이스 매출 내셔널지오 친환경 페트병 아웃도어업체 블랙야크 소재 레깅스 광고 실적 브랜드 역성장 산린 판매 겨냥 업체 
2537, 한집 압구정 현대 집주인 분통 ,종부세 장미아파트 정의진 노경목 보유세 재산세 공시가격 현실화 은퇴 자식 이웃 수십 집값 불만 세금 상승 정책 문재인 경제 
2538, 발코니 일몰 구경 바닥 추락  별난세계 ,임차인 몰려있긴 생일파티 줄여 간청 바위 발코니 소방 데일리메일 눈앞 집주인 추락 수용 인원 사고 규정 당국 경제 
2539, 임영웅 니코틴 실내 흡연 발암물질 ,전자담배 니코틴 담배 함유 임영웅 센터장 금연구역 담뱃잎 한국담배규제연구교육센터장 이성규 발암물질 배출 유해물질 법률상 흡연 궐련형 액상형 에어로졸 중금속 
2540, 수소 대그룹 삼성 ,수소 수소사업 생산 연료전지 수소충전소 포스코 플러그파워 액화수소 제철소 효성 이산화탄소 석탄 수소차 활용 추진 탄소 재계 그린수소 수소기업 
2541, 게이츠 이혼 발표 가족 아빠 ,부부 프라이버시 개입설 개척 북한군 성명 보장 이혼 결혼 성장 관계 단계 가족 발표 
2542, 손정민 한강 조사 목격자 ,실종 휴대 어머니 개입설 북한군 참고인 포렌식 작업 아버지 수사 경찰 조사 
2543, 공휴일 법안 발의 ,노동자 휴일 대체휴일 보장하 민간 노사협약 보장토록 창의성 소중한 대통령령 개입설 공휴일 북한군 효율적 공공 방해 법률 보장 공무원 
2544, 한강 사망 대학생 친구 경찰 참고인 조사 ,시신 실종 김현주 정밀검사 수상택시 승강장 수중 한강 사인 국립과학수사연구원 부검 공원 사망 현장 발견 경찰 조사 
2545, 먹재 정민씨 공개한 명쾌 ,최면 아버지 정은나리 동석 조사 손정민 경찰서 변호사 수사 
2546, 언제  잭팟 주인공 ,래디쉬 카카오 대표 스토리 비즈니스 래디쉬미디 창업 바탕 경쟁력 분야 그레이록파트너스 글로벌전략 래디쉬미디어 모바일시장 미국법인 소프트뱅크벤처스 스토리시장 웹소설시장 터테인먼트시장 
2547, 오토바이 사망사고 박신영 유족 사죄 ,유족분 피해자분 명복 고인 스포츠 지바 프로그램 아이오케이 조사 레슨 매거진 경제학과 시사교양 닥터 유가족분 전향 심신 사망사고 사거리 
2548,  갤럭시 플립 진짜 모습 ,갤럭시 플립 디스플레이 렛츠고디지털 삼성전자 폴더블폰 폴드 카메라 전작 스마트폰 가격 커버 모델 투톤 디자인 스펙 대중화 플래그십 업그레이드 
2549, 프로파일러 손정민씨 친구 부모 한강 이유 ,실종 승강장 수중 택시 손정민 수상 시신 공원 현장 발견 
2550, 한강 대학생 사망 주목 심리적 동조화 사건 진행중 ,사인 국립과학수사연구원 자상 차분 수사 엉뚱 마디 구두 손가락 소견 직접적 자제 부검 상처 공격 비난 발견 백신 
2551, 인도 갠지스강 교수 대학 ,인도 봉쇄령 총리 주저 공장 정부 대확산 전염성 파괴력 사태 김종수 의료용 갠지스강 책임론 산소 계단 중앙 단행 경제적 
2552, 마스크 써달라 요구 아이스크림 여성 경찰 수사 ,마트 마스크 직원 방역수칙 교육 착용 김애린 경찰 영업점 절실 운영 당혹 안내문 이용객 부착 의무화 입수 과태료 벌금 
2553, 빗속 열차 시간 실신 ,열차 승객 이채연 증평역 전기 실신 한국철도공사 스톱 환자 대전 강현종 대소원면 충주시 환승버스 무궁화호 예약해 허태웅 오한 선로 
2554, 갭투자 보증금 백억 ,세입자 자매 전세 두채 보증보험 정혜인 주민 있냐 정혜 비슷한 사모 유도해 갭투 백억 임대사업자 행각 구제 만기 보증금 
2555, 어버이날 가장 처참 ,노동부 현대제철 이덕영 명령 개선계획수립 개선점 보완점 서현권 안경덕 안전보건 안전보건진단 천안지청 송지원 안전점검 조선업 중대재해 증원 문제제 철강 
2556, 도지코 놨다 머스크 마케팅 ,머스크 도지코인 정진욱 마디 일론 농담 진행자 선물 꿍꿍이 신뢰기반 코메디 반등하지 어머니날 대척점 자기만 급락했 우주탐사 홍기훈 금융규제 
2557, 인도 이와중 노마스크 바글바글 갠지스엔 시체 무더기 ,봉쇄령 최후 총리 서혜연 선택지 결석계 출석부 국회의원 감염 방안 
2558, 수십명 미스 코리아 예선 실화 ,미스 수영복 예선 대회 한복 주최 글로벌이앤비 코르셋 상품화 한국일보 본선 생중계 참가자 심사위원석 무대 패션쇼 화보 선정성 전입 
2559, 정경심 강사휴게실 동양대 검찰 주장 유감 ,교수 원장 지문 증인 피시 서울시교육청 재판부 판결문 입시 선발 자녀 이르진 조모씨 학교생활기록부 한국형사정책연구원장 재판 범죄 감독권 같진 
2560, 초등학생 몸싸움 단체 ,공로자회 부상자회 공법단체 회원 유족회 단체 보상법 기념재단 구속부상자회 소위원회 회장 자격 조직 국가보훈처장 나명관 설립동지회 설립준비위원 자격자 장해 
2561, 주호영 에베레스트 이준석 팔공산만 ,경쟁해 지역주 영남당 행위 자해적 오연서 폄하 탈피 직격 발상 초선 혁신 원내대표 승리 중심 의원 비판 
2562, 윤석열 전화 누굴 도움 요청 ,허정 권력구조 개헌 윤보선 얘길 이세영 마크롱 정권 논설위원 정권교체 할아버지 후보 거대 안철수 지분 정당 반복 김병로 양보해 
2563, 손정민 친구 조사한 경찰 골든 정체 ,시신 실종 정밀검사 수상택시 승강장 수중 한강 사인 국립과학수사연구원 부검 공원 사망 현장 발견 경찰 조사 
2564, 셀트리온 치료제 세계 판매 ,파키스탄 체결 바이알 계약 노희준 출하할 레그단비맙 방위산업체 최대 계약물량 셀트리온헬스 성분명 판매 항체 산하 국방부 자회사 치료제 수출 
2565, 알트코 이더리움 사상 돌파 ,이더리움 비트코인 도지코인 장펑자오 달러 활용 가치저장 바이낸스 알트코 대장주 가격 거래 억달러 거래소 시세 수단 대체불가능토큰 반사익 비트코인이정훈 
2566, 한강 사망 대학생 친구 시간 조사 골든 가수 얘기 ,시신 실종 정밀검사 수상택시 승강장 수중 한강 사인 국립과학수사연구원 부검 재테크 공원 증권 사망 현장 발견 부동산 경제 경찰 
2567, 산삼 발견 감정 심봤다 ,천종산삼 덕유산 암반 감정 수령 뿌리 산삼 황색 발견 색상 흔적 시세 부엽토층 약초 옥주 조선말 뇌두 천종산삼은 미네랄 
2568, 갤러리아포레 전세값  돌파 ,이주 브르넨청담 이영호기 전세시장 강남권 월세 재테크 증권 수요 부동산 경제 대한민국 
2569, 머스크 만우절 트윗 현실화 도지코 스페이스 결제수단 이용 ,도지코인 머스크 우주 스페이스 반등했지만 도지파 행성 궤도 새터데 만우절 권예림기 응용 코미디쇼 상업 급락세 자처 나이트 발표 코인데스크 
2570, 비트코인 후계자 상승 ,비트코인 프로토콜 네트워크 유스코 컴퓨팅 달러 창업자 가상화폐 금본위제 모건크릭캐피털매니지먼트 월드와이드웹 투자운용사 가치 과소평가 권예림 부류 대장주인 고군분투 권예림기 
2571, 강풍 투명다리 바닥 공중 고립 아찔  별난세계 ,스카이워크 스릴감 장자제 휴양지 후난성 공중 관광객 심리 유리 바닥 상담 설치 중국 병원 경제 
2572, 뱃살 과일 건강 ,바나나 녹말 저항성 영양소 식욕 섭취 억제 견과류 산딸기 계피 고단백 스무디 완숙 유익균 아몬드 요구르트 버터 계란 채소 
2573, 작품상 미나리 스칼렛 요한슨 성차별 만연 ,배타성 비전문성 사란도스 만연해 테드 대행사 김선미 골든글로브 할리우드 개혁 차별 이상언 홍보 대형 약속 주식 
2574, 아버지 케이크 아들 아빠 ,아이 스택하우스 철자 생년월일 임선영 이상언 당국 주식 경찰 
2575, 게이츠 부인 이혼 결심 소아성애 격노 ,감방 감옥 엡스타 박현영 전출 보석 고장 녹화 타살 목숨 워싱턴 목격자 이상언 점검 체포 동료 재판 법원 검찰 
2576, 서울 시간 강원 반나절 생활권 ,원주 삼척 사업 용문 연결 강릉 강릉선 개통 노선 철도망 홍천 철도 포항 강원도 연결선 연장 동해 완공 신규 
2577, 오리온 꼬북좌 유정 한정판 꼬북칩 출시 ,유정 꼬북칩 오리온 한정판 모델 패키지 에브리데이 유정칩 인절미맛 츄러스 포토카드 꼬부 꼬북좌 눈웃음 동봉 발랄 재기발랄 소비자 스낵 
2578, 육아 라이프 밸런스 육라밸 ,아빠 육아 육아휴직 아이 자녀 엄마 공동육아 국제이주 포용사회센터 아내 외벌 회사 휴직 전업주부 가사 이직 가명 설문조사 부인 
2579, 게이츠 결혼 여친 여행다녀 가족여행 제외 자녀들 엄마 ,취재원 이혼 게이츠 익명 가족 발표 자녀 그레나다 서인도제 김민 멀린다 합의가 세간 초대 연예 여행 조건 달러 비용 
2580, 하수 고수들 이진구기자  못다한 ,국수 바둑 정치판 새누리당 대통령 알파고 인명진 조이구승자 조훈현 필다패 총선 당대 하수 비례대표 월드컵 비대위 조언 욕심 눈높이 
2581, 정규직 선언 정규직 만명 정규직 ,가계부채 정부 최저임금 경제학부 정규직 노인일 직접투자 과제 기초체력 연착륙 취업자 문재인 자산시장 국가채무 약화 회원국 청년층 선진국 상승 
2582, 조은산 김남국 전공 ,물가상승률 박태근 알고리즘 윤희숙 의원 가속화 반론 임대차 월세 공부 수요 반대 전환 공급 국민의힘 
2583, 백신 접종 사전예약 시작 자녀 대리예약 가능 ,주민센터 접종 호흡기질환자 강남대첩 유형법 지참 만성 신분증 어르신 순차적 유치원 어린이집 배달의민족 중증 쿠팡 예약 교사 가상화폐 인력 
2584, 보유 전환사채 만기 매각설 ,산업은행 지분 컨테이너선 해양진흥공사 매각 민영화 전환 만기 실적 블록딜 은행법 매각설 주식 해운 강세 발행 영업이익 수출 소유 
2585, 한강 사망 의대생 사건 수사 신상털 별점테 ,이은영 한강순찰대 강남대첩 유형법 실체적 예단 기동대 배달의민족 쿠팡 경찰청 국립과학수사연구원 가상화폐 진실 명품 부검 증거 확보 발견 경찰 
2586, 백신 대량 구매 백신 구매 중단 ,백신 아스트라제네카 계약 집행위 공급 억회분 구매 화이자 프랑스 눈돌리 브루통 알뜰주유소 에마뉘 국가 기름값 집행위원 황민규 줄폐업 투여 
2587, 임혜숙 박준영 노형욱 임명 강행 무안주기식 청문회 ,후보자 장관 청문회 노형욱 과학기술정보통신부 발탁 국토교통부 해양수산부 인사청문회 야당 과학기술계 반대 한진해운 임명 대통령 유능 능력 해수부 파산 
2588, 씨앤씨인터내셔널 청약 경쟁률 상장 ,씨앤씨 상해공장 용인공장 이슬람권 배은철 색조화장품 글로벌 프레스티 한수연 유연한 리더 시장 가속 도약 증설 설비 네트워크 라인업 공모 
2589, 남혐 논란 디자이너 해명 주가 상승 ,포스터 진실공방 캠핑 리테일 논란 김태헌 소시지 디자이너 남혐 해명 주가 소스 손가락 모양 메갈 사전캠핑 육류가공품 익명앱 표식 
2590, 정부 백신 사지마비 간호조무사 인과성 인정 의료비지원 ,진료비 김미희 충분치 지원 평가 의료비 불충분 마비 질병관리청장 결석계 출석부 이상반응 정은경 국내외 중증 입원 분류 보상 증상 
2591, 뉴스터치 라방 추락 ,나경철 여성 추락사했 공안국 기행 아찔 만류 아파트 관리사무소 아나운서 유서 결석계 출석부 화면 추락 국회의원 주민 발견 직원 
2592, 신규 확진 예방 효과 ,백신 김미희 식품의약품안전처 예방 신규 감염 접수 류마티스관절염 종창 신경계 수도권 효과성 접종 반응 자문단 중앙약사심의위원회 검사 평가 사례 
2593, 게이츠 아내 미성년자 성범죄 엡스타인 ,엄마 권경성 별장 김학 성명 인생 이혼 성장 부부 배우 단계 발표 
2594, 경찰 정민씨 친구 참고인 조사 친구 어머니 휴대폰 포렌식 ,엄마 강력팀 한강순찰대 오지혜 기동대 관련자 별장 김학 목격자 경찰서 증거 배우 확보 
2595, 오은영 남편 반복 외도 폭행 가정 ,남편 자녀 어머니 외도 이혼 주도적 가정 동아줄 엄마 관계 결혼관계 상담신청서 소리 상대 인간 경제적 내면 아이 온전 
2596, 닭고기 파란색 쥐약 신탄진 살묘남 ,살묘남 신탄진 동물구조 쥐약 엄마 범행 길고양 윤주영 진범 닭고기 합당 별장 김학 배우 처벌 
2597, 문희상 대통령 지지층 국민 통합 ,통합 대통령 국민 오만 한반 이명박 박근혜 능력 조언 뭉개려 엄마 과욕 한국일보와 청와대 권위주의 연연 이성택 이에스더 이반 
2598, 손정민씨 휴대전화 누구 통화 가능 ,국립과학수사연구원 실종 자상 수상택시 승강장 마디 수중 손가락 한강 사인 부검 시신 상처 공원 현장 발견 
2599, 세계 블루 맥도날드 정체 ,맥도날드 로고 파랑색 노랑색 매장 미러 블루 명소 경관 미관 프랑스 바위 노란색 파리 거리 흰색 전통 자연 네온사인 
2600, 의혹 정민씨 사건 친구가족 신상털기 우려 ,손정민 손현 영정 선물 정민이 순진 카네이션 과분 애비 어버 감격 확보 결말 가혹 신용카드 블랙박스 경찰 내역 목격자 
2601, 삼성 애플 이어폰 귓병 악재 절치부 반격  ,무선이어폰 톤프리 전자 커널형 살균 무선이어폰시장 세균 신작 이어폰 출시 스마트폰사업 프로 사용자 애플 염증 철수 피부 외이도염 사례 
2602, 사이 환전소 잠금장치 금고 ,환전소 양동훈 헬멧 남성 단계 용의자 경찰 공모 조사 건물 갤럭시 근무 상대 관리 관계 직원 확진자 대표 대한민국 
2603, 손정민 아버지 명명백백 ,손현 아버지 이럴 손정민 진실 근속휴가 박기완 명명백백 육체적 침착 주검 정민이 장례 심장 장례식 격려 결심 정신적 죽음 
2604, 경찰 손정민 친구 친구 아버지 소환 정밀 분석 ,골든 휴대 경찰 실종 어머니 조사 포렌식한 통화한 최면 발견 우호적 실종자 수사력 참고인 포렌식 공통 관심사 동선 정밀 
2605, 심봤다 함양 덕유산 자락 산삼 발견 ,길조 남덕유산 산삼계장 산삼항노화엑스포 오태 약초꾼 산삼 천종산삼 함양군 가을 발견 개최 갤럭시 확진자 대표 대한민국 
2606, 윤석열 유력 대선후보 평가 질문 대통령의 답변 ,시대정신 덕목 대통령 민심 방향 과제 공감 유력 국민 균형감각 도도 집단지성 대선 윤석열 통찰력 총장 표피 문재인 시대적 
2607, 중국 로켓 잔해 정오쯤 남태평양 추락 예상 ,추락 잔해물 우주발사체 창정 남태평양 지점 예측 정오쯤 발사체 정동훈 중국 낙하 과학기술정보통신부 한반도 발사 결석계 출석부 호주 국회의원 
2608, 고흥 해상 실종 해녀 발견 ,선장 해삼 김수근 조업 잠수 안치 채취 결석계 출석부 바다 장비 착용 국회의원 상대 병원 조사 
2609, 인형 뉴욕 유아 피격 ,감시카메라 정동훈 서너 발사 결석계 출석부 지장 논쟁 용의자 경찰 뉴욕 추적 생명 국회의원 현장 남성 병원 
2610, 무사고라 폐차급 수입차  분노폭발 사고차 ,카히스토리 중고차 사고차 자동차 점검 내역 카센터 소유자 이력 정비 성능 자동차시민연합 점검기록부 보험개발원 특약 침수 보험금 보험사 지식 
2611, 게이츠 결혼 여친 휴가 누구 ,윈블래드 피플 멀린다 게이츠 마이크로소프트 결별 뱅크스 블래드 아우터 오두막 행글라이딩 노스캐롤라이나 파트너스라 험머 끈기 타임 컨퍼런스 벤처기업 벤처 
2612, 이번 아파트 포기 매입 실수요자 ,월세 전세 임대차 월세신고제 공급 물량 규제 시장 감소 계약 전셋값 세입자 상승 아파트 부정적 부작용 불안 부동산 관악푸르지오 
2613, 로또 아파트 청약 포기 선언 이유 ,만점통장 몸테크 청약설 청약조건 출현설 대출자 전매 고준석 청약자 겸임교수 동국대 개인별 김하 소망 담보 실거주 세트 신용대출 영혼 
2614, 청년들이 하루 빠숑 경고 강영연 인터뷰집 ,드레스룸 하늘 보금 테라스 확장 녹지 환경 서재 미래가치 강영연 시멘트 아스팔트 용산역 고층 포화 로망 발코니 가족 강북 
2615, 모발 발모샴푸 효능 확인 ,탈모 샴푸 카론바이오 모발 더마 임상시험 원료 피부과학연구기관 일반의약품 대표 추출물 식물 성장 화장품 독일 의료기관 등록 감태 공동임상시험 
2616, 정민씨 친구 마지막  골든 ,정민이 규명 손정민 카네이션 애통 과분 차종욱 민간구조사 간직 김현주 보답 수상택시 불행 대신해 승강장 입수 주도 선물 시신 
