,title,contents
7582, 변창흠 국민들 서울 공급 생각 ,공급 박병석 장관 국회의장 변창흠 의장집무실 국회 국토교통부 주택 양도세 의장 주택난 가능해 안정감 절대 시그널 통지 국민 시장 
7583, 충격 피해자들 증거인멸 판결 증거 ,가습기살균제 애경산업 증거 케미칼 간사 증거인멸 진상규명 성분 가습기넷 고광현 메틸이소티아졸리논 사회적참사특별조사위원회법 상임간사 안용찬 장동엽 조순미 천식 클로로메틸이소티아졸리논 개정해서 
7584, 롤러블 강렬 등장 삼성 폴더블 긴장해 ,롤러블 콘퍼런스 스마트폰 전자 콘셉트 폴더블 감탄사 시선강탈 화면 대안 극찬 폴드 호평 디스플레이 시청 외부 가전업체 글로벌마케팅센터 김진홍 
7585, 직원 연인간 성적  캡처돼 메신저 공유 ,스캐터랩 개인정보 연애의과학 직원 챗봇 개발자 입사 스케터랩 사용자 로그 캡처해 논란 가이드라인 내부 연인 유출 증언 명확 소비 
7586, 지방대 정시 경쟁률 사실상 미달 초토화 우려 ,대학 정시 경쟁률 추가 소재 학생 상위권 수험생 종로학원하늘교육 지역거점국립대 경쟁 감소 충북대 강원대 전북대 중간집계 학과 선호 남대 
7587, 한파 편의점 내복차림 어린이 엄마 ,편의점 송국회 강추위 따뜻 협약 어린이 겨울 이웃 경찰청 탄소중립 기후 생존 거리 전환 부모 
7588, 채팅앱 여학생 가출 유도 화물차 감금 성폭행 ,위치추적 전자장치 재범 부착 기각 재판부 명령만 성행교정 평가척도 보호관찰명령 치료프로그램 성폭력범죄 문준영 보호관찰 장래 개연성 취업제한 신상정보 이수 
7589, 코스피 순매수 역대 최고 당국 신용대출 긴급점검 ,신용대출 김도영 코스피 급증 개인 천억 증권사 은행 순매수 개인투자자 계절성 나오다보 최정욱 금액 순매수액 기싸움 트래픽 금감원 가계대출 
7590, 유승준 해달라 정부 비판 처벌 청원 ,병역 공정해 난리법석 기피자 정치범 면제자 신뢰감 유익 격앙 유승준 장관 돈벌이 비판 성범죄자 싸늘 상실 위법 신년대토론 손석희 
7591, 어린이집 원장 정인이 외할머니 학대 살인방조 고발 ,정인이 외할머니 살인방조 학대 고발 방청권 보호전문기관 내복 아이 상습 중계 양부모 신년대토론 손석희 어린이집 모니터링 원장 편의점 법정 
7592, 공군부대 마리 먹튀 공군  확인 ,환불 공군부대 부대 배달비 치킨 공군 리뷰 본사 개인 주문 동의하 공군본부 설사 군부대 원만 복통 납품 신년대토론 손석희 
7593, 증발 카지노 노조 보안직원 금고 ,카지노 노조 직원 최충 금고 보안 장난 거액 회사 본사 재무관련 문석빈 몇억 부피 만원권 랜딩카지노 꼬리 보너스 이화영 
7594, 일본 발견 전파력 시뮬레이션 충격 ,허비 박인서 오은솔 윤설영 긴급사태 오사카 김지혜 신년대토론 손석희 일본 사례 병원 정부 
7595, 여배우 성추행 의혹 배진웅 추행 맞고소 ,배진웅 여배우 경찰조사 고소한 배우 법무법인 성추행해 고소내용 언급되진 굿캐스팅 고소인 지푸라기 강제추행죄 유추 성추행한 김은빈 대리 짐승 강제추행 
7596, 아빠 아이 친모 한국말 순창 ,시민감찰위원회 순창 회부 블루 객관적 수위 우울증 경찰청 외부 처벌 전문가 
7597, 폴더블폰 세계 롤러블폰 ,롤러블폰 롤러블 디스플레이 폴더블폰 전자 주름 폴더블 스마트폰 에뮬레이터 화면 오포 폼팩터 스냅드래곤 가격 사양 실물 퀄컴 시장 출시 
7598, 백신 미군부대 한국인 왼팔 스치기만해 통증 ,백신 접종 미열 주사 통증 미군 왼팔 한국인 독감 동료 반응 증세 신체 면역 게보린 김신우 접종했지만 대책본부장 미군부대 
7599, 주식 강남 부자들 ,오현 김대훈 정소람 조정기 낭패 장세 정반대 개미 대출 투자 경제 
7600, 영끌해서 아파트 초조 밤잠 ,주택가격전망지수 수도권 상승 집값 수급지수 오름폭 주택산업연구원 갈아치웠다 주택가격 안혜원 기록해 최고점 중개업소 금융회사 연구소 공인중개사 전셋값 매매가 설문조사 
7601, 비트코인 곡소리 투자하 각오 ,가상화폐 투자 비트코인 군드라흐 반등 거품 비트코인가격 금융행위감독청 달러 의무화한 채권왕 영국 파생상품 보트 임현우 투기성 상승장 고위험 간판 
7602, 대한민국  쏟아부 넷플릭스 제작자 블랙홀 급부상 ,넷플릭스 스위트홈 킹덤 극장 진출 작품 제작사 지상파 방송사 콘텐츠산업 협업 헤이스팅스 영화 좀비 드라마 불시착 첫해 대한민국 제작비 
7603, 역대급 널뛰기 비트코인 하루 만달러 폭락했다 회복 ,비트코인 비트코인가격 달러 건들락 더블라인캐피털 지수 변동폭 뉴욕 거품 증시 가격 만달러 가상화폐 불안 비트코인공급량 조지메이슨대 코웬 피츠패트릭 정치 
7604,  전액환불 공군부대 갑질 공방 ,공군 공군부대 환불 치킨 부대 갑질 배탈설사 오구한 퍽퍽해서 사병 치즈볼 환불한 실례 설사 업체 공론화 주문자 조용 군인 
7605, 외국 앙코르와트 캄보디아 경제 ,수출 캄보디아 만달러 시엠레아프 세계은행 여행사 자전거 증가 박우석 시엠레아프시 안길현 역내포괄적경제동반자협정 캄보디 프놈펜 누적 반등할 전자부품 회복 비교 
7606, 공군부대  치킨먹 환불 갑질 논란 병사들 복통 반박 ,부대 치킨 리뷰 닭가슴살 갑질 가게 공군부대 배달료 공군 환불 주문 심각한 대대장 복날 내려 설사 생각해 허미담 군부대 
7607, 구직수당  주간 만명 이달 지급 ,고용부 신청자 국민취업지원제도 고용센터 차관 구직수당 수급자격 취업지원서비스 김보경 박화진 구직자 접점 청년층 고용노동부 방문 격려 연초 신속 방역 
7608, 날씨 서울 중부 한파 ,공기질 기상캐스터 캐스터 서풍 눈발 미세먼지 추위 중심 가시거리 약해졌다 이동하시 연결해서 영상권 눈구름 오염물질 한풀 구름 중국발 한파특보 
7609, 담배 때문 격리 병사 숙소탈출 골절상 ,격리 육군 병사 숙소 간부 독신 도서 양주 금연 예방적 발목 급식 담배 창문 탈출 장병 추락 원칙 치료 
7610, 서울 지역 눈발 시내 곳곳 결빙 우려 ,퇴근 서울시 비상근무 결빙 눈발 혼잡 대중교통 폭설 돌입 시내 피해 단계 
7611, 내복 아이 친모 입건 ,그같 겉옷 차림 내복 여아 입건 음식 부인 시민 법원 발견 조사 
7612, 비트코인 추락 증발 각오해 장가희 뉴스픽 ,옐런 장가희 파생상품 제도권 재무장관 걸림돌 당선인 비판적 실험 가상화폐 비트코인 남성 기업 가격 경제 
7613, 셀트리온 항체치료제 효과 임상 결과 공개 ,셀트리온 개발본부장 항체치료제 조건부 임상시험 리제네론 릴리 박현진 수출길 이재우 이론상 이한 대웅제약 진전 녹십자 유럽의약품청 식품의약국 토론회 본부장 
7614, 금융위원회 공매 연장 종료 ,류정훈 공매 시장조성자 개선방안 청원글 금지 폐지 접근성 공매도 금융위원회 실험 제도 연장 감안 개인 불법 처벌 강화 남성 
7615, 쿠팡 국내 나스닥 입성 예비심사 통과 ,쿠팡 나스닥 예비심사 상장 입성 증시 통과 연준 기업가치 아마존 나스닥행 워시 높은데요 임원진 능선 상장설 수천억 소프트뱅크 손정 
7616, 아파트 재건축 아파트 ,재건축 박연신 아파트 공급 기대감 선호현상 서울시장 민관 법무대학원 요동칠 고준석 겸임교수 시그널 동국대 매매가격 막판 실수요자 공약 재보선 
7617, 상소문 스르륵 롤러블폰 ,전자 스마트폰 분기 최인준 피처폰 단번 롤러블폰 시장 부진 적자 연속 전략 출시 영화 사업 계획 
7618, 동갑 유혹 엄마 ,성착취범죄 어린이 청소년 스마트폰 성착취범 첨단기기 정지섭 대두 성착취 연방수사국 수업 극단적 기대 급증 조건 학교 선택 확산 아이 
7619, 별장 성추행 논란 배진웅 후배 강제추행 맞고소 ,배진웅 배우 법무법인 고소한 영화 법률대리인 강간미수 고소내용 강제추행죄 대리 강제추행 실명 명백한 성추행 후배 일방적 유포 드라마 감빵 
7620, 아내 여동생 자녀 조카 총각인척 여성 접근 ,여동생 미혼모 유부남 사실관계 언론계 아이 착수 배제 업무 성평등센터 한국방송공사 강영수 연인관계 동거인 사규 지망생 본관 행세 미혼 
7621, 거리두기 단계 집합금지업종 영업 단계적 재개 ,거리두기 단계 집합금지 조정안 개편 업종 단계적 협회 방역 검토 안정 착수 확산세 심층적 의료대응 체계개편 영업 생업상 위험 
7622, 아이돌 성적 노리개 알페스 옮겨붙 논란  ,알페스 아이돌 실존 음란성 소설 성적 성범죄 음란물 이용자 동성 적나라 남성 유포 동성애 커플 문화 청원 노리개 국민청원 
7623, 치킨 이젠 배달 평가  ,배달 다양화해 월간활성이용자수 모바일인덱스 모바일 상점 요기요 라이더 쿠팡이츠 배달앱 배달의민족 고객 
7624, 대통령 세계 진입 전망 발언 하루만 진짜 달성 ,이탈리아 성장률 대한민국 국민소득 수출 국가 경제 국제통화기금 수입원 강타 신년사 서비스업 관광 선진국 명목 억달러 순위 예측 분기 
7625, 코스피 추락  신호 김세형 칼럼 ,증시 동학개미 외국 공매도 팬데믹 연초 금리 국면 공매 비트코인 연장 테슬라 결판 그러잖아 김세형 때려잡으 심효섭 인정사정 자산운용본부장 
7626, 거리두기 조정안 발표 집합금지업종 영업재개 단계적 확대 ,집합금지 거리두기 단계 개편 방역적 업종 두되 생업상 위험 안정화하 애로 코로나백신 접종 방역 검토 완만 가속화 단계적 곤란 
7627, 친구 친구 남편 호텔 감금 ,경찰 휴대 임의동행 코로나백신 신병 지구대 발견 객실 전원 분리 조사한 수색 진실 신고 장소 실종 방향 불안 폭행 
7628, 국민소득 이탈리아 경제규모 세계 ,이탈리아 대한민국 국민소득 성장률 달러 선진국 경제 수출 이탈리아와 세계은행 국제통화기금 급락했지만 전년도 코로나백신 신년사 서비스업 발표 관광 역전 
7629, 동물학대 의심 택배기사 사연 ,강아지 택배기사 사연 경태 동물학대 짐칸 기사 반려견 서로 게재 학대 논란 놀아 부탁드린다 분리불안 서로간 심장사상충 근무 고객 
7630, 염색 흰머리 맨얼굴 파자마 서울시장 주자들 인간미 경쟁 ,의원 장관 중소벤처기업부 나경원 평범 박영선 새침한 아내 프로그램 꾸밈없 소중함 인간미 탬버린 팔굽혀펴기하다 편집해서 홈트 남편 이원조 파자마 
7631, 박범계 폭행 주장 고시생 보좌관 공개 ,사존모 인사청문회장 캡모자 폭행 메시지 기술해 이창훈 의원 보좌관 대표 후보자 회원 사실관계 응답 문자 경찰서 얼굴 부인 논란 
7632, 전세 계약갱신청구권 행사 여부 ,세입자 계약갱신청구권 시행규칙 공인중개사 공인중개사법 업무정지 행사 감경 개정 주택 임대차 임대 분쟁 가중 서류 국토교통부 민간임대 이전되기 중개대상물 
7633, 작심삼일 다이어트 지속 가능 방법 ,지중해식 식단 지중해 식이 올리브오일 교수 섭취 토마토 피라미드 가공음료 리뷰논문 백미 변용 의학논문 정제곡물 정진수 체중감량 통곡물 펍메드 
7634, 신규 확진 안팎 거리두기 재조정 ,유전자증폭검사 입국자 항만 의무화 뒷얘기 발급 연예계 출발 공항 음성 바이러스 외국 국가 시행 
7635, 굿캐스팅 대장 김창수 출연 배우 여배우 성추행 경찰 조사 ,별장 조사 성추행 조연급 특정부위 강간미수 남자배우 단역 뿌리치 경찰 굿캐스팅 포천시 조연 피해자 이동한 김유민 추행 여배우 뒷얘기 
7636, 이낙연 월성원전 방사성 물질 충격 폐쇄 불가피 감사원 ,감사원장 최재형 감사원 공직 원전산업정책관 월성 원칙 원장 수행 원전산업정책과장 조기폐쇄 예산결산특별위원회 경징계 의연 월성원전 타당성 지원 신년사 실무자 
7637, 리더십 부족 경제정책 실패 무당층 정부 ,무당층 정부 야당 이탈 신년인 전체응답층 촛불정신 응답자 피해업종 현실론 실책 재난지원금 반사이익 여당 계승 국민 남북 안보 선별 
7638, 문자 신청 재난지원금 누구 ,재난지원금 문자 특수고용노동자 지원금 여도현 매출 프리랜서 창업 심사 소상공인 신청 있었느냐 제한 사업자등록번호 짝수 홀수 가능 긴급고용안정지원금 집합제한 
7639, 예배 기도원 하나 때문 전체 거리두기 상향 ,기도원 진주시 예배 집단감염 방역당국 결번 진주국제기도원 확진자만 방문 다반사 미등록 외부인 해산 역학 방문자 진주 신도 노골적 관련자 
7640, 하루   폭락 비트코인 거품 ,비트코인 가격 업비트 달러 코인데스크 회복 투자자 주차 매수 매수해서 볼까봐 코인거래소 구매 거래 편승 폭락했 낙하 비트코인은 하락장 
7641, 한파 내복 여아 엄마 아이 ,아이 엄마 내복 다섯살 친척집 편의점 어린이집 발견 여성 학대 내복차림 넉달전 함정민 보호 콧물 아동복지법상 외투 조용희 여자아이 
7642, 만개 여성 한국의 매직쿠션 ,미샤 일본 쿠션 매직쿠션 에이블 판매 버라이어티숍 커버력 매장 법인장 파운데이션 유통구조 오사카 진열 출시 화장품 피부 강인규 니케 
7643, 유승준 한말씀 아드님 때문 불편 ,병무청 병역 미국시민권 입국금지 마녀사냥 엄연 소멸 기피 국적 취득 인권 불편 의무 추미애 제조 비난 장관 아파트 대한민국 
7644, 양파값 사과 샐러드 황제식단 ,가격 원재료 상승 가공식품 치킨 동기 부위별 이동금지령 통삼겹 고등어 꽁치 동아오츠카 샘표식품 오로나민 채솟값 포카리스웨트 가금 강민호 농축산물 
7645, 승진 넘버 김여정 강등 무슨일 ,김여정 정치국 후보위원 당대회 당중앙위원회 명단 부부장 북한 직책 여동생 관여 위원 김정은 위원장 격상 결과만 김위원장 대남사업 대북전단 
7646, 한국산 둔갑 중국산 이름 교수형 ,한국산 중국산 과일 방콕 김원장 브랜드 과일수입회사 농산물유통공사 동남아국가 동남아시장 디자인도용 붙이다보 신고배 써붙 와차라콘 우리배 위파비 이겨내긴 이윤민 
7647, 정인이 묘소 입양아 아빠 편견 확산 일반화 우려 ,입양 아동복지학 일반화 가정 성급 강지영 입양문화 입양특례법 입양가정 이론적 정익중 친자녀 지양 강화 숙명여대 위험요인 아이 교수 건전 
7648, 교회 눈치 폐쇄 예배 세계로교회 인정 ,폐쇄 교회발 서부교회 김영록 산발적 대면예배 가처분 집행정지 강행 교회 대처 탄소중립 기후 생존 기자회견 불안 주민 내부 전환 
7649, 소상공 특고 프리랜서 지원금 지급 최대 ,최준혁 지원금 고용안전지원금 이상철 버팀목자금 빙자 중복 금융사 비밀번호 콜센터 중소벤처기업부 고용노동부 번호 정부 계좌 재난지원금 탄소중립 기후 사항 
7650, 과태료 허위 매물 세입자 피해 ,매물 중개 감시센터 광고시장 대행앱 부동산 보증금 집주인 과태료 월세 실거래 공인중개사 광고 점검 현장 사이트 신고자 저가 처벌 
7651, 일본 바이러스 긴급사태 확대 검토 ,긴급사태 장유진 재발령한 가나가와현 감염세가 교토 도쿄도 일본 수도권 간사 오사카 검토 교도 전파력 발령 그제 정부 지방 부정적 
7652, 베이비 크림  아기 얼굴 ,중국산 겪다보 자국산 김희웅 자국민 백신 불신 맥락 제약 과제 식품 안전성 수입 국가 생산 판매 접종 중국 논란 
7653, 쥐포 짜리 혹한 내복 ,손하늘 아동복지 형사입건 정소민 김희건 물리적 분리 어머니 행위 처벌 법원 아이 검토 경찰 
7654, 마스크 식사시간 매너캡 감염 예방 ,윤지윤 종이 간단해 안전도 조립도 식당 마스크 남양주시장 조광한 시민 가림막 관내 휴대용 번거 남양주시 손바닥 친환경 소독 상대방 
7655, 스트레이트 학교 학력 빈익빈 부익부 ,하위권 중위권 상위권 탐사기획 스트레이트 교육청 성적 격차 학생 중간층 중등교육과장 포물선 권혁재 매주 빨간색 수학 학력 원격 부산시 
7656, 비트코인 시총 이틀새 증발 재반등 본격조정 팽팽 ,비트코인가격 비트코인 가상자산 억달러 창업주 거래소 투자심리 시장금리 국채금리 달러화 위험자산 이정훈 달러 급감 인플레이션 원화 시총 상승 가격 
7657, 김정 주머니 조용원 파격승진 김여정 제외 ,정치국 위원장 부부장 조선중앙 위원 조용원 후보위원 북한 외교 당중앙위원회 중앙위원회 비서 수행 김여정 서열 위상 부장 연합 선출 
7658, 성희롱 이번 집주소 공개 논란 ,차별 공적 학습 혐오 데이터 대표 로직 진일보 사회적 챗봇 범용 알고리즘 보정 편향 문제의식 젠더 제정 기술적 면접 
7659, 유승준 명예훼손 처벌 청원 등장 ,수입 사이트 녹스인플루언 추산 수백 통계 가량 증가 
7660, 담배냄새 신천지 후유증 ,증세 신도 완치 대구교회 신천지 후유증 만성화 미각상실 병원치료 자가치료 자유기술 탈모증 혈장공여 메신저방 조사 대책본부장 민복기 일가량 대구시의 
7661, 화장 순식간 미녀 추남 여성 분노케한 광고 ,화장 광고 여성 남성 치한 중국 수건 경보망 신경보 회사 뭇매 아이디어 설정 추근대 묘수 천연덕 열중 화사 의미심장한 
7662, 과학고 의대 자랑 세금 먹튀다 유퀴즈 섭외 논란 ,과학고 의대 경기과학고 유퀴즈 자랑 세금 나는유퀴즈 먹튀다 의대간 진학생 영재 이공계열 재방 거랑 추천서 출연분 등록금 학벌 섭외 
7663, 일본 우리 하늘길 관제권 ,국제항공운 양식통 아시아나항공 대한항공 항공 항공사 항공기 블루 우울증 개국 가입 가량 
7664, 유승준 죄명 마녀사냥 호소 ,약속 부도덕적 여러분들과 시민권 비겁 유승준 이야기 입대 하나씩 라면 취득 사정 가족 확진자 미국 대표 대한민국 
7665, 대통령 부정평가 국민의힘 민주당 ,주간집계 국민의힘 긍정 리얼미터 더불어민주당 부정 격차 지지율 백종규 정당별 평가 기록해 질문지 국정수행 대통령 열린민주당 오차범위 유권자 정의당 
7666,  거리 단계 천여 사연 ,예배 전재영 차상은 서부교회 강행 교회 폐쇄 명령 법정 처분 법원 운영 논란 확진자 대표 대한민국 
7667, 정은경 다음 확진자  불합리 방역조치 수정 ,실천 위험요인 불합리 사회적 이행 수정 중앙대책본부 총리 계절적 신현준 거리두기 수용성 방역 제압 사회부 담보 피로감 국면 수용 
7668, 재난지원금 지급 신청 입금 ,소상공인 지원금 문자 지원 매출 방역 김장하 사업자번호 메시지 신규 피해 김장 특수형태근로자 짝수 홀수 고용안정지원금 고용센터 버팀목자금 강화 
7669, 수술날 골프장 아내 이상운 이혼 고백 ,가족오락관 이상운 일번지 자키 진품명품 미련 개그 유머 비디오 퇴원 혼자 회상 골프 고백 후회 데뷔 병원 
7670, 시간 방치 대소변 내복 엄마 학대 ,쓰레기 권남영 어린이집 가득 친모 조사 학대 경찰서 일상 해명 아이 경찰 
7671, 흔적 장준호씨 점퍼 한강 강변 발견 ,수색 동절기 실족 강변 점퍼 언어 드론 상대방 한파 수중 작업 의사 발견 계획 경찰 
7672, 서로 다리 커플 비극 그놈 ,커플 샤오보 인기 양재영 반응 감동적 결말 비극적 별명 고향 바람 사연 이혼 상처 남편 여성 
7673, 동학개미 선봉장 대한민국 미국 ,주식 노후 장기투자 주가 빚투 지수 금융 주식투자 연금 투자자 퇴직연금 불로소득 기관투자가 실물경제 괴리 우리나라 동학개미 미국 개인투자자 
7674, 동료들 눈폭탄 출근 스페 간호사 ,스페인 헌신 의료진 온대 이베리아 필로메나 반도 마드리드 시베리아 폭풍 저기압 영웅 폭설 취약계층 연대 기상청 공기 거대 노동자 
7675, 코난 슈워제네거 트럼프 제거 ,슈워제네거 트럼프 대통령 의사당 수정 민주주의 나치 난입 단련 백종민 유대 실패한 오스트리아 당선인 공화당 영화 의회 미국인 뉴욕 
7676, 병역기피 유승준 눈물 호통 ,유승준 수입 사이트 수익 차이 소셜블레이드 한승곤 업로드 한화 추산 통계 급등 급증 집계 경제 
7677, 정은경 확진자 예상 상보 ,감염재생산지수 추계 환자 중앙방역대책본부장 코로나바이러스감염증 확진자 본부장 정은경 예측 집단 수치 방역당국 신종 감소 경제 
7678, 샤넬 사랑한 모델 스텔라 테넌트 극단선택 ,테넌트 스코틀랜드 샤넬 고티 데번셔 캐번디시 얼굴 매카트니 베르사체 창의력 낙점 패션쇼 패션지 귀족 보그 공작 유머 앤드루 김명진 
7679, 샤인머스캣 꿀고구마 대한민국 일본 ,샤인머스캣 일본 포도 식물 자원 종자 품종 고구마 등록 대한민국 당도 베니하루카 종묘법 로열티 개정 반출 재배 채소 출원 
7680, 코로나 이익 이낙연 이익공유제 ,원내대표 승자 주호영 정의당 기업 대변인 보완입법 사회연대세 사회주의식 시장원리 이간질하 장태수 경제단체장 한국경영자총협회장 사회안 안혜진 포퓰리즘적 혈안 경영계 
7681, 재난지원금 지급 신청 입금 ,소상공인 버팀목자금 특고 프리랜서 정부 고용안정지원금 지원금 긴급고용안정지원금 콜센터 전담 지원 재판매 심사 집합금지 재난지원금 문자 수급자인 신청제 특별피해업종 
7682, 흰머리 민낯 파자마 인간미 서울시장 주자들 ,박영선 장관 민낯 의원 중소벤처기업부 더불어민주당 중앙대책본부 중앙재난안전대책본부 유력 막춤 머리띠 서울시장 아내 겨를 꾸밈없 단란 드라이한 소탈하다 조민정 
7683, 성희롱 이번 동성애 혐오 학습 우려 ,학습 동성애 혐오 개발업체 데이터 차별 인식 챗봇 편향 공적 젠더 개발자 악용 사회적 취급 재판매 사용자 성적 이용자 
7684, 짐승 장모 사위 노인학대 무죄 ,피고인 폭언 항소심 사정 판결 재판부 방임 위법성 피해자 법리 오인 재수사 유기 정서적 위법 정인이 무죄 항소 충분 
7685, 의회폭동 잔혹상 공개 경찰 ,시위대 경찰 의사당 방패 살려 비명 반역자 경찰관 저지선 출입문 의회 충돌 트럼프 민얼굴 방독면 서편 영차영차 외마디 진압봉 
7686, 하루 사퇴 성추행 징계 전력 ,배주환 과거사정리위원회 유념 이형빈 아이러니한 양홍석 화해 성추문 허점 하나 대국민 정직 위원 지도부 성추행 추천 진실 검증 처분 
7687, 재난지원금 지급 홀짝 신청제 ,업종 소상공인 사업자등록번호 짝수 홀수 특수고용직 원활한 연매출 프리랜서 영업제한 헬스장 노래방 매출액 집합금지 재난지원금 지원금 문자 카페 식당 
7688, 전국 대 한파 특보 곳곳 ,한파 전남권 북극발 경상 최고기온 특보 밤사 영하권 추위 서부 내륙 수도권 
7689, 문제 요금 허가 이유 ,요금 요금제 알뜰폰 천원 정진욱 이통사 텔레콤 과학기술정보통신부 통신사 사업자 과학기술통신부 기존요금 문명배 알뜰통신사업자협회 알뜰폰으로 허창식 깎아 대여비 정도씩 
7690, 연애 양극화 정규직 ,정규직 이성 교제 이성교제 결혼 확률 권희진 의향 경제 소유 가족종사자 한국보건사회연구원 포괄적 증가 내집 저출산 남성 사업체 미혼 
7691, 조두순 세금 분노 청원 ,조두순 출소 기초생활수급자 기초연금 주거급여 선정 안산시 급여 배우자 나영 단원구청 사회보장제도 부부 신청일 생계급여 한국일보와 만성질환 억장 예정자 
7692, 배수구 세탁기 역류 거실 한파 피해 ,한파 해발 낙동강 세탁기 항공편 폭설 측정 지방 가거도 고창군 부안군 빨래감 빨래방 셀프빨래방 숭어 시설감자 윗세오름 저수온 진안군 
7693, 슬램덩크 영화 실사판 이색 요청 까닭 ,북산고 슬램덩크 애니메이션 산왕공고 산왕공고전 강백호 영화 만화 영화화 주인공 사이트 결승골 극장판 박인기 서태웅 실사판 실사화 아수성 영화화해 
