,title,contents
0, 결혼  임신 노르딕스키 간판 서보라미 별세 ,출전해 관왕 대회 장애 굴러떨어져 노르딕 동계패럴림픽 벤쿠버 서보라미 원주의료원 동계체전 소치 하반신 출전 스키 평창 빈소 입문 마비 
1, 배달업체 사장 몽둥이 폭행 ,조모 배달기사 사장 배달 배달대행업체 배달비 나무 몽둥이 남양주 김모 수행 금액 각목 막대기 참다참다 프로그램상 거리 남부경찰 조씨는 
2, 서울대 학생처장 피해자 코스프레 논란 ,서울대 갑질 기숙사 학생처장 처장 코스프레 이모 청소 영어 노동자 죽음 논란 개인 의뢰한지 협력부처장 아내 구민교 인권센터 학교 
3, 역대 최다 확진 백화점 음식점 안전한 ,검사 임시선별검사소 확진자 천여건 송민지 수도권 검사소 나흘간 선별검사소 한영주 대기 감염경로 경로 애플리케이션 역학조사 임시 초등학교 통계 불편 
4, 현아 식은땀 미주신경성실신 건강 ,섭취 스트레스 서울동부지부 한국건강관리협회 개인차 미주신경성실신 온탕 나트륨 공포증 금물 수분 밀폐 온도 충분한 지방 폐쇄 대처 의식 증상 
5, 위경련 구급차 아기 머리  ,아이 아빠 헌신적 낌새 관계 폴란드 연인 임신 여행 출산 대학 감염증 신종 코로나 
6, 생리대 착용샷 도넘은 광고 여성들 ,생리대 팬티형 착용샷 업체 광고 폭주 자세 불만 광고사진 구매욕 사진보 살다살다 쓰는 모델 성적대상화 코브라 광고물 팬티 누굴 
7, 없다더니 배터리 도약 한경우 케이스 스터디 ,납축전지 양극재 고체배터리 사원계 삼원계 배터리 리튬이온배터리 개발 상용화 증설 삼성 생존 로케트 리튬이온전지 밧데리 세방전지 액체전해질 에너지밀도 생산 
8, 수박 주방 청소 만뷰 인기 비결 ,집안일 꿀주부 살림법 어느덧오늘 회사 매몰 별거 휴직 우주 육아 초등학생 청소 실천 유튜버 긍정적 계기 가치 엄마 아이 
9, 수백 집단감염 사례 백화점 술집 일파만파 ,확진자 도심공항터미널 무역센터점 안정권 제조업장 파르나스몰 확진 코엑스 원생 개별적 제조업체 감염경로 유흥주점 어린이집 백화점 관련해서 교사 음성 예산 
10, 화장실 춘천 사흘째 ,춘천시 수돗물 녹물 지어먹지 소독약 수도꼭지 공급 시민 재난문자 지역주민 흙탕물 욕조 수도 세탁 춘천 면밀 오염 냄새 전역 
11, 통 폐지론 이준석 ,당혹 인수분해 통일세력 퇴역 존치돼야 최영섭 한심한 권영세 무용론 대령 수학 필요도 의원 오명 폐지 감사원장 빈소 최재형 경악 
12, 휴가 폐업 회원들 헬스장 사장 말로 ,회원 연체 헬스장 임대료 부장판사 재판부 변제받지 이동욱 재판 가스비 피해금 독촉 안모 대부업체 변제 합의서 관리비 이용료 운영 
13, 중학생 몸무게 트럼프 막내아들 폭풍 성장 ,트럼프 배런 멜라니아 도널드 대통령 모리스타운 저스트자레드는배런 영국성공회 예비학교 막내아 세인트 에어포스원 사립학교 뉴저지주 명문 앤드루 근황 중학생 공화당 
14, 얼굴 심장마비 소녀 셀프 피어싱 비극 ,피어싱 패혈증 이자밸라 이자벨라 세균 시력 시술 생전 면허 손상 노출 생명 의사 감염 사망 전문가 병원 
15, 아저씨 원빈 돼지부대 강철부대 출연 그들 박용한 배틀그라운드 ,특수부대 부대 임무 정보사 정보 북한 국군정보사령부 국군화생방방호사령부 돼지부대 북파 사이버사령부 원빈 특수임무 특수임무대 특임대 대량살상무기 유사시 화생방 공작원 
16, 예약 필러 경우 부작용 주의 ,접종 부종 필러 임상시험 백신 추진단 시술 이력 식품의약품안전처 얼굴 이상반응 관찰 연령 위중증 부작용 미용성형시술 웨이크포레스트대 접종할지 노스캐롤라이나 
17, 아나운서 유카타 삭제 ,스포티비 박한 필라테스 소영 경솔 정원 아나운서 강사 예능 의식 여행 삭제 배우 가족 논란 
18, 새벽 접속 대기 스벅 굿즈 열풍 이유 ,김효혜 유통 경쟁심리 생생유통 생활경제 풍토 핫이슈 허영심 우월감 증정 기자페이지 수량 맥락 발달 한정 마케팅 한국인 감정 작용 
19, 최소 억마리 폭염 홍합 불가사리 떼죽음 데스밸리 ,고보현 국제연구팀 베치 열파 가브리엘 프린스턴대 기후변화 과학자 극단적 교수 발표 
20, 맘카페 천명 유아박람회 확진 전면 중단 ,관람객분 상주한 서울국제유아교육전 세계전람 유아박람회 참가기업 키즈페어 코엑스 전관 무증상자 행사장 고득관 전시장 방문자 상시 확진자 이행 수칙 음성 
21, 여름 티셔츠 한장  꾸안꾸 핫템 뭐길래 ,삼성물산 신세계인터내셔날 패션 신명품 수입 성과급 톰브라운 분기 메종 메종키츠네 아미 실적 매출 대기업 영업이익 꼼데갸르송 띠어리 전임직원 총사 
22, 일본 도쿄올림픽 정상회담 수용 대한민국 전달 ,정상회담 일본 회담 총리 대통령 도쿄올림픽 정부 방문 개회식 문재인 교도 성사 해법 방안 각국 대한민국 간부 개최 정상 
23, 신규 확진자 사흘째  ,확진자 신규 국외유입 중앙방역대책본부 지역 접종자 격리 백신 누적 환자 수도권 접종 국외 예방접종대응추진단 내국인 검역 선별 선별진료소 보건소 
24, 수도권 델타 알파 한명 감염 ,확진자 수도권 변이 델타 환자 검출 예방의학 검사 단계 알파 김부겸 질병관리청장 신규 감염 정은경 증가 경로 국무총리 연속 
25, 자정 접종 사전예약 ,사전예약 콜센터 접종 예약 잔여백신 예방접종센터 고령층 지방자치단체 예방접종 질병관리청 분류 아스트라제네카 자녀 취소 물량 백신 
26, 생리대 자세 여성들 광고 분노 이유 ,여성 의뢰해 비난 모델 멈춰주길 출시 눈요깃감 오버나이트 상품화 속칭 직설적 날씬 선정성 여성분 임신부 체형 대상화 좌표 입점 
27, 확장 윤석열 이후 급격 보수화 ,윤석열 검찰총장 자유민주주 총장 정치 정서 중도층 보수적 장모 더불어민주당 보수 출마 가치이긴 맹비난하 역사관 집토끼 점령군 보수단체 색깔론 
28, 운전 휴대전화 버스 처벌 강화법 언제쯤 ,버스 흐지부지 황보혜경 지대한 처벌법 시야 정지 운행 법안 안전성 자격 국토교통부 생명 휴대 거리 추진 국회 확보 
29, 기본수칙 위반 집단감염 긴장감 문제 ,방책 개개인 델타 변이 억제 수칙 바이러스 나라 감염 사태 확산 강화 접종 방역 백신 
30, 아이티 영부인 피격 육성 남편 말할기회 무차별 총격 ,아이티 암살 괴한 권력다툼 아이티계 콜롬비아인 강성옥 최빈국 당국 미주 불분명한 사살 후송 상원 가담 정국 대통령 대륙 임시 
31, 수도권 거리두기 단계 ,경마 무관중 경륜 숙박업소 객실 임시 공연 스포츠 성격 공원 행사 운영 
32, 리포트 코끼리 소수 극명 대비 ,계정 억압 중국 자유 소리소문 네드 프라이스 코끼리 킬로미터 국무부 젊은이 마디 네트워크 침묵 대변 무리 폐쇄 통제 대학 
33, 도시락 주식 이마트 도시락 선봬 ,주식 도시락 고기말 무말랭이 애호박 랜덤 고객 착안 발음 이마트 반찬 동일 김치 기획 구성 활용 투자 기업 
34, 비트코인 옹호론자 미너드 만달러 폭락 예상 ,비트코인 미너드 만달러 구겐하 암호화폐 급락중라 비트코인옹호론자 튤립열풍 달러 비트코인가치 옹호론자 급락할 투기꾼 경제전문 달러대 비트코인은 알트코 스콧 최고점 
35, 구글 회장 삼성 반도체 생산능력 과소평가 집중화 우려 ,슈미트 전략적 양자 주도권 컴퓨터 중국 관계 영역 회장 내놨었는데 합성생물학 미국 따라붙고 기술 서초사옥 협력관계 중국과 무역 제언 
36, 서울시 노가 골목 이날 확진 ,골목 서울시 노가 을지로 홍보 방문 계정 명소 관광 단계 격상 확진자 상제 엇나갔다 노가리골목 정취 힙지 소개 신규 
37, 때문 비행기 탑승금지 여성 ,사이피나르 탑승 비행기 보디빌더 터키 복장 데니즈 피트니스 아메리칸 텍사스 항공 눈물 여성 보디빌딩 비행사 어깨끈 탱크톱 포트워스 댈러스 
38, 중학생 몸무게 폭풍 성장 트럼프 막내아들 ,트럼프 배런 멜라니아 아빠 슬로베니아 엄마 별거 대통령 결혼 성장 모델 부인 부모 미국 
39, 트럼프 막내아들 배런 성장 포착 ,배런 성장 배런은 노스캐롤라이나주 에릭 멜라니아 막내 성숙 까닭 공화당 여사 농담 가방 평범 트럼프 가량 모델 엄마 행사 
40, 서울서 아파트값 상위 노도강 ,아파트값 매수 도심부 서민층 가세한 도봉 동북권 박합수 구매력 상승 노원 부동산수석전문위원 수석전문위원 아파트 강남권 중저가 중산층 풍선 실수요자 
41, 이재명 국밥 이낙연 ,만병통치약 기본소득 이재명 고수 지사 부자 공격 기본정책 김빠진 명추 병법서 이중차별 번영 재난소득 국밥 선택 싶진 연연 본경선 
42, 아이티 영부인 피격후 육성 남편 말할기회 안주 총쏴 ,아이티 암살 모이즈 여사 아이티계 콜롬비아인 남편 최빈국 당국 미주 괴한 사살 후송 국민 가담 대륙 미국인 총선 연말 
43, 모텔 종업원 대박낸 흙수저 손정의 ,야놀자 소프트뱅크 비전펀드 손정 이수진 투자 쿠팡 수조원대 흙수저 모텔 산하 회장 산업요원 여행앱 일조한 총괄대표 대표 계약 대체복무 
44, 캐럿 다이아몬드 발견 야구공 ,다이아몬드 원석 캐럿 발견 보츠와 채굴 광산 보츠와나 카로웨 컬리번 역대 가로길이 다아이몬드 루카라 마시시 모크 즈와넹 채굴회사 김수한 
45, 중학생 몸무게 트럼프 막내아들 폭풍 성장 근황 ,트럼프 배런 멜라니아 슬로베니아 영국성공회 예비학교 세인트 사립학교 명문 앤드루 대통령 아빠 결혼 성장 모델 엄마 부인 전문가 
46, 뉴스인사이트 깐풍기 징계 지연 명예훼손 고소전 ,대사 징계 직원 중앙징계위원회 절차 대사관 문현군 소송전 인사혁신처 부임 몽골 위원회 의결 발급 수사기관 위원장 공무원 경징계든 모함해 
47, 위급환자 신체접촉 성추행 판단 기준 ,강제추행죄 성립 개방 객관적 행위 추행죄 위급한 밀폐 규정하 성적 높기 인간애 있기 했던거다 혐오감 처벌 우리 퇴색 행위자 
48, 논문 공세 윤석열 맞불 쥴리 의혹 상식적 ,대선 김정인이 쥴리 국민의힘 비대위원장 감사원장 빈소 최재형 장례 술집 조문 영입 인재 부친 훌륭 유승민 원장 김종인 고등학교 
49,  묵혀놨더니 애주가 위스키테크 세계 ,위스키 야마자키 빈병 년산 맥켈란 주류상가 공병 남대문 주류 일본 가격 매튜 산토리 거래 경매 면허 판매 한정 고급 
50, 군통령 브레이브걸스 광고주 제시 조건 ,인지웅 광고 꼬북칩 조건 장병 블루칩 위문공연 프라이팬 광고계 오리온 광고주 복지 공연 기업 댄스트레이너 보은하 브브걸 스파오 써머퀸 
51, 운전 얼굴 반쪽 폐차망신 선팅 예방 ,틴팅 가시광선 투과율 농도 필름 선팅 창유리 운전자 운전석 피부 수명 시야 측후 불스원 타월 자외선 소모품 시공 흠집 
52, 수도권 식당 예약 줄취소 강원엔 야간라운딩 전화 ,예약 수도권 장사 취소 펜션 해수욕장 강릉 골프장 술집 행정명령 자영업자 방역수칙 확진자 경포 야외수영장 예약자분 식당 광안리 낙산 
53, 에어컨 선풍기 활용 실내 환기 ,점검 냉동기 온도센서 마모 부식 오일 잔여량 모터 압력 성능 유출 
54, 델타변 전파력 스테로이드  포커스 ,고수해 치중 바퀴 감염내 자전거 접종률 착용 마스크 거리 정책 강화 접종 방역 교수 병원 백신 
55, 임신 서보라미 별세 예능출연 ,패럴림픽 관왕 벤쿠동계버패럴림픽 성화봉송자 소치동계패럴림픽 장애인동계체전 크로스컨트리 평창동계패럴림픽 눈물짓 동계 동계체전 소치 호실 개회식 봉송 성화 의료원 하반신 출전 
56, 윤석열 호남민심 바닥 저류 ,호남 더불어민주당 기득권 윤석열 공동대표 비판 지방선거 지대 이민족 임경빈 카페사장 호남대안포럼 이데올로기 총선 우파 문재인 보수 노예 사과해 
57, 신규 확진자 최다 경신 비상 차대유행 ,단계 수도권 본격화한 일별 성남시 기세 친족 물리적 장례식 어린이집 속출 집회 결혼식 다중이용 시위 초등학교 개최 사적 집단감염 
58, 이준석 통 통일 이인영 부족한 역사 ,장관 역사의식 대표 이인영 부처 이준석 과시 부족한 여가부 통일 국민의힘 성과 대륙위원회 멈추시길 미수복 보수쪽 야당대표 조국평화통일위원회 카운터파트 
59, 일률적 방역규제 비판 오세훈 단계 스텝 ,서울시 번복 주점 집회 카페 강동구에만 실내골프연습장 체력단련장 상생방역 정치평론 오세훈표 김인호 시범사업 선제검사 광화문광장 서울시의회 긴장감 시장 시정 
60, 와중 스타벅스코리아 단체회식 확진자 나와 ,회식 직원 뷔페 스타벅스 출장 스타벅스코리 전수조사 출근 판정 확진 대회의실 파트장 강당 유요 징계해 이정회 눈살 검사 영문 
61, 만취 포르쉐 인도 돌진 바퀴 쾅쾅 ,바퀴 포르쉐 차량 도로 반대편 기둥 신호등 해운대 만취 소리 승용차 주차 인도 운전자 사고 주민 빗길 폭발음 구석찬 
62, 아파트 옥상 아령 이유 ,경찰 테라스 도망 인명피해 현행범 상점 발부 구속영장 손상 체포 진술 검찰 조사 
63, 벨기 대사 부인 마지막 모습 ,환경미화원 벨기에 대사 기환해야 레이쿠 폭행 시앙 외무부 옷가게 지체 도시락 연루 종결 임기 주문 비난 처벌 부인 장관 
64, 친구 남제 성폭행한 교사 최후 ,실패자 전문학교 물리치료사 소년 그녀 인생 등록 진술 미래 학교 관계 가족 
65, 포착 마지막 불금 서울 모습 ,국가공무원 시험장 공채 방역수칙 시험일 대형쇼핑몰 경신한 인사혁신처 확진자수 각지 수험생 쇼핑몰 확진자 백화점 비교적 전국적 중앙방역대책본부 시험 대형 
66, 극명 성적표 여학생 수학 등급 하늘 별따기 ,수학 여학생 모의평가 과학 등급 점수 성적 학생 
67, 백신 교실 마스크 우려 지침 ,백신 마스크 학교 학생 델타 접종 대면수업 이경희 교실 질병통제예방센터 현장 워싱턴 공중보건대학 사우버 샤츠 미국 결석 스튜어트 학교별 
68, 접종 예약 백신 ,접종 화요 운수업 돌봄인력 예정자 입영 환경미화원 택배기사 연령층 사전예약 백신접종 백신 종사자 초등학교 학원 교사 자유 서울시 수도권 
69, 장마 폭염 열대 예고 ,폭염 장마 장맛비 김재훈 북태평양고기압 폭염특보 무더위 소나기 주춤 기상청 극한폭염 열돔현상 전문기자 티베트고기압 폭염경보 찜통더위 티베트고원 확언 중첩 
70, 거리두기 전격 격상 정부 확산세 ,확산세 이진우 계획도 보강 진단검사 역학조사 특성 외출 중앙사고수습본부 자제 모임 인력 약속 확대 정부 
71, 영국 여왕 왕실 정원 공개 ,엘리자베스 여왕 정원 가든파티 개방키 피크닉 암울한 사태 버킹엄궁 지참 슬리퍼 잔디 청바지 방문객 반입 복장 자유로운 반려동물 치킨 
72, 아파트 옥상 아령 구속 ,아령 케틀벨 범행 테라스 파손 경찰 조사 옥상 극단적 동기 건물 선택 아파트 
73, 이인영 장관 이준석 대표 부족한 역사의식 사회 과시 ,장관 대표 여직원 이인영 남북관계 감수성 젠더 응답 성과 야당 개선 여성 비판 
74, 백명 육박 최다 경신 가능성 ,수도권 백명 신규 김주환 확진자 경신 전국적 확산세 사회적 생활권 냉정 개통 김부겸 골자 퇴근 감염자 모임 배제 국무총리 
75, 세계 파킨슨병 발병 ,파킨슨병 경로 단백질 뉴런 미토콘드리아 손상 가족형 신경조직 인터페론 항상성 생쥐 환자 잠정적 분석해 독성 다량 발현 연구팀 폐기물 
76, 붕괴 아파트 실종 파라과 대통령 처제 시신 ,파라과 붕괴 라나시온 아파트 현장 발견 대통령 시신 실종 고미혜 베니테스 아브 아세베 에우클리데스 부부 미국 로페스 멕시코시티 보모 
77, 서울시 단계 노가리골목 홍보 논란 ,골목 노가 단계 서울시 을지로 외국 계정 홍보 영어 거리두기 한상균 노가리골목 방문 을지 격상 명소 관광 수도권 정부 
78, 서울대 학생처장 사람 피해자 코스프레 ,오세정 시험지 피켓 민주노총 조합원 규탄 청소 대학교 노동자 눈물 기자회견 총장 
79, 감자튀김 누런 치아 충격 ,치아 이물질 피시앤칩스 싱가포르 주인 가게 여성 마더십 충격적인 환불받았다 음식 변색 소봄 잠깐 감자튀김 소름 금치 직원 기색 
80, 온몸 동맥 파열 시속 롤러코스터 여성 사망 ,롤러코스터 파열 얀코비치 동맥 온몸 내흉동맥 속력 매거진 사망 혈관 공포감 애호가 설비 부연 저항 운행 공기 죽음 점검 
81, 가석방 일주일 포크 부탁 거절 엄마 시간 폭행 ,헬런 엄마 감옥 출소 사소 재수감 한집 거처 발작 공황 구타 악몽 중재 교도소 테이블 통증 용서 체포 머리 
82, 수도권 단계 풍선 효과 휴가철 지역 사람 몰릴라 ,여행지 수도권 예약 나곡 방역관리대책 정유경 김규현 영덕 울진 관성 해수욕장 경주 음주 한정 휴가 중앙사고수습본부 인원 주민 제한 
83, 한강 사망사건 석달 정의 이름으로 ,죽음 추모 유튜버 뒷맛 레커 정의감 씨앗 부채질 사이버 두달 씁쓸 무책임 표출 축적 불신 파장 수사기관 손정민 한강 
84, 원전 효율적 오세훈 서울 서울시 ,태양광 전력 서울시 에너지 자립률 원전 사업 생산 정책 재생에너지 시장 베란다형 서울환경운동연합 지열 하천수열 박원순 전력량 소비 대도시 
85, 현직 의사 슬의생 판타지보 본원적 메디컬 드라마 ,의료 보호자 라포 이식 윤리 진상 드라마 상호불신 참고서 황진미 만렙 스펙터클한 자연분 의사 환자 실례 슬기 대중문화평론가 산모 
86, 성관계한 여성 몰카 조연배우 유포 여자친구 집행유예 ,유포 조연 촬영물 피해자 대화방 자백 명예 집행유예 게시 협박 훼손 단체 소재 삭제 재판부 징역 범죄 범행 선고 
87, 전세살 신도시 입주 이럴땐 청약 무효 ,사전청약 난민 전세 공급 본청약 입주 청약 거주 재산권 무주택 기타 제약 가수요 계양 행사 전매 수도권 잔금 충당 
88, 폭행 연루 논란 출국 벨기 대사 부인 ,처벌불원 불송치 뒤통수 옷가게 직원 면책특권 공소권 외교관 경찰 입건 의사 피해자 가족 조사 
89, 그알 이용 주장 손정민 과장 장면 ,재연 그알 최단거리 손정민 직접적 경찰 사인 상처 정보공개청구해서 먼거리 범죄혐의점 불가역적 변사사건심의위원회 낚시꾼 뇌리 막강한 발견 시청률 손현 
90, 손정민 중요 사람 함구해 의혹 친구들 험담 말길 ,손정민 아빠 정보공개청구했던거 진행사항 범죄혐의점 정민이와 변사사건심의위원회 탄원서 말문 열람 정민이 공문 종결 수령 경찰 형사 경찰서 제목 증거 
91, 친구 성폭행한 여교사 징역형 ,학생 성명문 실패자 전문학교 취약성 물리치료사 착취 주길 대면 조종 원망 가족 남용 죄책감 바보 사죄 믿음 지위 부당 
92, 시절 마약 강요 성폭행 모델 폭로 ,브리짓 시크릿 모델 맬컴 빅토리아 속옷 스트레스장애 란제리 공황장애 외상 사이즈 폭로 브랜드 브리짓은 획일화 미국 거식증 경험해 런웨 
93, 김부선 진중권 사랑 연애 누구 증거 ,김부선 진중권 여배우 증거 교수 데이트 스캔들 토론 검증 재탕해 공론장 대선경선 심증 이따위 이성적 혼탁 대비해서 의미심장한 헛소리 
94, 손님 예약 취소 자영업자들 망연자실 ,거리두기 방역 손실보상 수도권 정부 단계 예약 소상공인 자영업자 취소 소공연은 복원력 전국카페사장연합회장 고깃집 고장수 소상공인연합회 중차대 피해지원 정책 
95, 수도권 단계 학교 원격 ,단계 거리두기 수도권 김부겸 제한 정부서울청사 중앙대책본부 중앙재난안전대책본부 총리 가회적 적용키 공동사진취재단 시차제 예방접종자 출퇴근제 둘이 무관중 원격수업 유보 
96, 궁녀 조선 공중화장실 미스터리 ,정화조 분뇨 생활하수 현대식 유적 정착 시기 발굴 소장 유럽 세계적 구조 일본 평가 
97, 여성 남성 정체 ,관악경찰 폭행 관할서로 수갑 공무집행 대기발령 강남경찰 인계 방해 입건 경찰 
98, 시국 자정 귀가 아빠 옐로카드 ,서약서 아빠 맹세 중학생 대전 옐로카드 마스크 새삼 핑계 속상 귀가 식사 거주 방역수칙 불안 약속 신규 회사 가족 
99, 신입생 알몸 공유 한겨울 물고문 ,수사 대학 학생 이승진 김용우 행정 기본적 격리 징계 사안 학교 치료 절차 관계 병원 경찰 
100, 신규 확진 역대 최다 수도권 거리두기 단계 격상 ,확진자 수도권 천여 접종자 유입 누적 환자 신규 신현준 손실보상법 접종 감염재생산지수 사회부 국민 항만 최대치 감염경로 검역 위중증 
101, 장맛비 소나기 다음 무더위 장마 ,고기압 장마 열대야 무더위 소나기 내륙 기상청 정혜윤 기온 북태평양 예보분석관 장마전선 성질 기승 폭염 태풍 본격적 공상민 우리나라 
102, 수도권 거리두기 단계 격상 주간 ,확진자 수도권 천여 접종자 유입 누적 환자 신규 신현준 손실보상법 접종 감염재생산지수 사회부 국민 항만 최대치 감염경로 검역 위중증 
103, 통화 만명분 확보 자랑한 ,백신 분기 대통령 화상 확보 간호대생 보건의료인 반셀 대확산 공급계약 병원급 비밀리 스테판 아웃제 타결 의대생 만명분 모더나 제약회사 
104, 남자 유명 속옷 모델 폭로 ,브리짓 맬컴 모델 시크릿 빅토리아 여초짜리 외상후스트레스장애 거식증 런웨 섭식 진정제 따끔 발작 공황장애 에이전트 공황 달콤한 남성 충고 
105, 실종 만삭 불륜녀 발견 뱃속 태아 ,산토스 브라질 도스산토스 캄포스 발견 유부남 태아 임신 살해 아기 시신 실종 불륜녀 외과적 리우데자네이루 뱃속 만삭 법의학 자연적 
106, 인천상륙작전 민간 몰살 인천시 주최 전시 논란 ,인천상륙작전 맥아더 회랑 피란민 장군 역사 파괴 그림 민간 건물 개항장 남루 몰살 역사문화 인천시립박물관장 인천시민애 인천시의회 조우성 리모델링한 
107, 정도 철수 존재감 예상 ,애플 전자 안드로이드 아이폰 점유율 여의도점 삼성전자 애플스토어 베스트샵 돈독 판매 스토어 운영체제 결국 대리점 편리 접근성 흡수 가전 
108, 아들 괴물 가석방 일주일 친엄마 시간 폭행  ,객원기자 헬런 크라운 김정호 괴물 교도소 수감 용서 징역 선고 법원 
109, 벨기 부인 폭행 연루 주한대사 지체 ,벨기에 레스쿠이 대사 윌메스 외무장관 폴리티코 지체 주한 벨가 소피 시앙 폭행 장관 브뤼셀 쑤에치우 주재국 외무부 한국과 정치전문 
110, 수도권 단계 초강수 시이후 인모 ,공연 단계 친족 사적모임 인원제한 수도권 집중적 숙박 선별진료소 거리두기 방역 격상 최우선적 홀덤게임장 홍해 인척 혈족 행사 시행 
111, 카페갔다 규정위반 개인과태료  ,벌칙 접종자 김포공항 실외 마스크 과태료 모임제한 위반사례 출국장 김인철 불요불급 수도권 확산 거리두기 국내선 감염병예 김영 입국자 관리자 
112, 암살 아이티 대통령 시신 총알 영부인 고비 ,사저 아이티 괴한 대통령 판사 주차 데스탱 르누벨리스트 마약단속국 보시트 용병 탄피 포박 에드몽 모이즈 가사도우미 총알 사상자 침입 
113, 현대차 노조 파업 결정 성과급 이유 ,노조 전기차 파업 임단협 현대차 교섭 국내공장 조합원 투자 노사 중노위 정년연장 요구안 기본급 내연기관차 미래 성과급 감소 생산 
114, 강용석 이재명 조카 살인죄 무기징역 김부선 진술 ,지사 조카 변호사 김부선 살인죄 비밀 인간 법정 이재명 진술조서 증거 경천동지 연인관계 변론 무기징역 가족 대리인 출하 판결문 
