,title,contents
4996, 구미 여아 친모 남편 아내 임신 출산 진술 ,여아 큰딸 출산 내연남 차명투 석모 유기 수사 공범 친부 프로파일러 친모 차익 경찰 유전자 성과 상대 검사 병원 
4997, 아방궁 가짜뉴스 트라우마 영농 사저 시비 폭발 문대통령 ,대통령 야권 사저 아방궁 적법하 차명투 예우 인내 참모 거듭 공세 직접적 차익 전직 대목 자제 태도 공격 분노 
4998, 상견례 인모  허용 거리두기 연장 ,수도권 돌잔치 영유아 제한 상견례 영업 인원 전문점 직계가족 영업제한 유흥 목욕탕 운영 다중이용 모임금지 카페 동반한 공연장 거리두기 
4999, 주호영 대통령 비료비 농약비 지출 내역 공개 ,처남 대통령 원내대표 박철응 영농 사저 주호영 농약비 묘목비 비료비 종자비 투자정보 손인사 윤동주 진노 선거 겁박 사고팔아 헌납 
5000, 원숭이 일만 구조 실종 파일럿 ,원숭이 항공기 브라질 열매 나무 추락 구조 소형 소방대 오지 안토니우 정글 조종사 조종 레스토랑 공군 실종 광산개발업자 새알 
5001, 취재후 당첨 로또 명당 세금 ,교통유발부담금 부과 로또 판매소 용인시 더현대 연면적 교통 민원 세금 용인시청 체증 교통혼잡 않으냐 부담금 연관기사 혼잡 인파 친절 
5002, 리포트 한한령 제작자 ,한한령 개봉 영화 세훈 교류 캣맨 주인공 엑소 드라마 합작 중국 연기 한국인 중국인 중국으로서 사드 조연 신호탄 방영 
5003, 파주서 직원 발견 경찰 첩보 ,직원 문예슬 간부 첩보 발견 음성변조 파주 근무 경찰 수사 삼방리 순환고속도로 지역본부 합동수사 기잡니다 김기곤 김형준 개발 김현석 
5004, 이탈리 인구 절반 월요일 ,권경성 잉크 일회용 로고 재활용 조처 악화 바이러스 엄마 대책 방역 발표 
5005, 사먹 딸기케이크 스트레스 ,디저트 누데이크 강지원 브랜드 예술작품 이재연 영감 진열 잉크 일회용 로고 요즘 재활용 요소 디자인 식사 매장 문화 음식 
5006, 영국판 강남역 시위 ,여성 런던 집회 외출 시위 에버라드 클래펌 사디크 경찰 조현병 강남역 두둔 피켓 방역 잉크 그릇 일상적 시위대 일회용 
5007, 교회 망해 목사 ,교회 피고 마땅 판사 범국가적 확진자로 범행 최두선 물거품 확진됐는데 양형 역학조사관 신도 잉크 엄벌 목사 일회용 감염병 로고 
5008, 은행권 가계 금리상승 폭탄 째각째각 ,금리 기준금리 가계대출 상승 대출 은행채 이자유예 신용대출 중앙은행 미국 유동성 압박 지속적 집계 만기연장 비상불 지표금리 하단선 수요 
5009, 파주서 사업본부 간부 발견 ,차명투 전북본부장 투신 유서 자살 핫라인 차익 우울감 목숨 상담 청소년 지인 예방 생명 발견 아파트 전문가 가족 국민 
5010, 사기 천 투자  환급 피싱 주의 ,업비트 보이스피싱 이더리움 가상화폐 피해액 투자 거래소 입출금 예방 전광판 천원 전화번호 재판매 사례 계좌 표시 계정 은행 입력해서 
5011, 악마 아빠 징역 보험금 자폐 아들 살해 ,엘메젠 보험 만달러 보험금 익사 보험사 아내 검찰 가입 보험료만 샌페드 실행한 월터 자폐증 가장해 부두 차명투 사악 어부 
5012, 드라마 펜트하우스 민설아 죽음 드라마 위근우 리플레 ,죽음 오윤희 민설아 위근우 선정성 펜트하우스 재현 복수 살인 작품 드라마 소비 삼길 신은경 약혼식장 진지희 쪼그라든다 층위 키스신 
5013, 직원 발견 사망 경위 조사중 ,김지원 화단 유서 책임자 자살 핫라인 우울감 상담 청소년 지인 예방 생명 발견 아파트 전문가 여성 가족 
5014, 사장님 직원 동료 지인 중개 사실상 브로커 ,대출 토지 과천농협 단위축협 의문 공동소유주 근무이력 합조단으로 특수본 김희진 낙찰받 송진식 상임 연고 차명 과천 시흥 직계가족 담보 
5015, 대통령 사저 의혹 맹공격 야권 해명 ,특검 허물 대통령 의원 여권발 합수부 감정조절 삽자루 자제력 죄악시하 윤영석 김지원 포클레인 대지 후보 검경 특권 정진석 민망 
5016, 구미 여아 친부 친모 내연남 불일치 ,아이 경찰 출생신고 남편 유전자 검사 방치 출산 유전자검사 확복하는게 친정어머니 전모 급선무 왕래 친정 김천지원 신병 심문 아래층 
5017, 경기 파주서 직원 발견 이틀 연속 사고 ,직원 상담 컨테이너 사망 청소년 동료 투신한지 한건 법원읍 파주사업본부 박세환 전북본부장 통화한 화단 파주시 발견 성남시 어플 가족 
5018, 남편 마약한 재범 아내 신고 ,한성희 필로폰 투약한 발부 도주 추가적 구속영장 법원 단계 직원 경찰 
5019, 모닝 얼굴 가짜 유튜버 고백 사실 ,얼굴 가상 스튜디오 외모 오제욱 유튜버 심리적 스트레스 존재 뉴띵 동일화 만났다는데요 콘테츠 합성해 강박 많으세요 슬럼프 콤플렉스 전까진 
5020, 파주서 사업본부 간부 발견 ,상담 청소년 김도식 전북본부장 투신 어플 유서 자살 우울감 목숨 정신 지인 예방 생명 발견 아파트 직원 전문가 가족 
5021, 공사 소음 항의하자 노인 무차별 폭행 ,폭행 류제 성낙중 주민 철거업체 피해자 반말 균열 철거 소음 극심한 외면 건설 공사 보상 건물 상대 피해 추진 
5022, 세기 커플 로드리게스 로페즈 결별 불륜설 부정 ,로드리게스 로페즈 알렉스 니퍼 약혼 스타 결별 르크로 뉴욕 세계적 리얼리티쇼 매디슨 신시아스커티스 메이저리그 홈런 댄서 만능 식스 통산 
5023, 엄마 비극 해리 여왕 복수 ,해리 왕실 엘리자베스 마거릿 에드워드 공주 결혼 찰스 마클 영국 왕자 군주제 여왕 다이애나 이혼 방황 반기 심프슨 어머니 
5024, 시간만 금붕어 낙동강 페놀 오염사고 ,낙동강 페놀 상류 환경부 오염 수돗물 석포제련소 녹조 수질 내성천 영주댐 오염사고 유충 환경 기업 대강 설치 규제 사무총장 
5025, 홍현희 학교폭력 기억 오류 사과 고소 ,홍현희 소속사 대면 선처 고소장 명예 사과 오류 게재 훼손 접수 블리스 취하서 쿨한 동창 면모 아티스트 당사 강경 
5026, 목길이 우크라 여성 모습 자랑 몰카 ,티첸코바 내분비전문 마르판 말팡 외견상 콩팥 올가 환자 에피소드 검진 증후군 특이한 막내 신장 대중교통 회상 외모 질환 소견 
5027, 고수 경고 주식투자 고통 시간 수도 ,기업 산업 캐시 우드 소로스 윤지호 염블리 바이오주 게임 파이 투자 선택 확률 바이오 업종 경쟁력 실수 시장 주가 
5028, 삼성 조투 최후통첩 전기 비용 감면해달라 ,오스틴시 제안서 텍사스주 세금감면 삼성전자 최후통첩 이재철 직시 애리조나주 경쟁적 뉴욕주 후보지 지방정부 매력적 문장 감면 재산세 인센티브 결정적 
5029, 유노윤호 몸싸움 단속 도주 시도 ,김수근 몸싸움 나경운 동석자 강남구청 공무집행방해 도주 행정 업소 사과문 경찰 경찰관 수칙 입건 처분 여론조사 영업 방역 검토 
5030, 파주서 직원 발견 경찰 첩보 접수 접촉 ,망자 며칠전 현장감식 법원읍 파주사업본부 나들목 임상재 첩보 파주시 컨테이너 내사 그제 고속도로 토지 자살 핫라인 경찰 우울감 소유 
5031, 남편 마약한 아내 신고 남성 ,필로폰 소변검사 경찰 임상재 복역 투약 출소 마약 조사 전력 양성 긴급 체포 여론조사 반응 현장 발견 
5032, 유노윤호 자정 무허가 유흥주점 ,술집 유흥주점 관할구청 접객 강남구청 일반음식점 운영 감염병예 종업원 행정처분 영업제한 자정 업소 입건 적발 등록 방역수칙 형태 수사 
5033, 본부장 극단 선택 수사대상 ,이준삼 합동특별수사본부 경찰 정년퇴직 전북본부장 전문위원 본격화한 수사 내사 유서 책임자 자살 핫라인 우울감 극단적 민간 상담 청소년 공무원 
5034, 마약범 베테랑 형사 용의 차량 중태 ,성실하시 활동하시 연장자 특수공무집행방해 김경인 진두지휘 모범 마약 구속영장 법률 경찰청 관리 현장 관계 직원 경찰 
5035, 축제 취소 봄꽃 관광지 노마스크 상춘객 눈살 ,마스크 이승룡 조홍 광양 절실해 김경인 서로 기본적 방지 증상 바이러스 접촉 착용 거리 사회적 확산 
5036, 산부인과 출산기록 진짜 아이 행방 ,아이 친부 출산 남편 엄마 주변 초음파 윤두열 김영석 검사 별거 산부인과 행방 눈치 진료 공모 유전자 임신 아빠 
5037, 농협 지점 대출 강원 원정대출 ,대출 북시흥농협 투성이 제곱미터 오은솔 직원 이화영 금융감독원 홍남기 부총리 불법 조사 
5038, 플로이드 유족  배상 ,데릭 쇼빈 수갑 플로이드 유요 초간 무릎 살해한 경찰관 체포 기소 경찰 
5039, 남성 편의점 직원 감사장 표창장 ,편의점 대피처 재발견 교사 본사 침착 표창장 아동학대 모범학생 복학 교육용 소정 가산점 장래 직원 집착 군대 입시 아르바이트 
5040, 미얀마 길거리 널브러진 대한민국 제재나 ,미얀마 군부 시위 국가고문 최루탄 아웅산 시위대 남편 제재 수출 본격적 양곤주지사 아내 널브러져 인권조사관 스물 택시운전사 뱃속 토머스 
5041, 분노 이준석 영농 대통령님 김재원 아들 버르장머리 ,대통령 사저 민망 영농 농지 국민 경력 항변 부지 분노 그정 노무현 취득 맹폭 경호 선택적 침묵 문재인 최고위원 
5042, 중국인 대한민국 휴대폰 안산다 점유율  ,중국인 못펴 자국폰 충성도 애국 형국 아이폰 소비 애플 삼성 스마트폰 삼성전자 
5043, 명문대 캐슬 사람 점수 서열 ,범블 데이팅앱 여성 여성친화적 페미니스트앱 울프 휘트 데이팅 남성 장려 문제의식 평등 프로필 퇴사 창업자 설계 출발 익명 홍보 
5044, 접종 의료 붕괴 의료계 우려 이유 ,환자 조시형기 응급실 본래 중증 총집결 수용 분류 부작용 재테크 증권 치료 접종 검사 병원 백신 부동산 대한민국 
5045, 여배우 시상식 드레스 알몸 시위 ,프랑스 세자르 극장 시상식 폐쇄 영화상 축제 드레스 문장 영화 드무스티어 마시 마시에로 카스텍스 패스트패션 배우 영화인 코린 정부 
5046, 유노윤호 단속 술집 무허가 유흥주점 ,조시형기 동석 질책 종업원 총집결 소속사 재테크 장소 증권 해명 방문 여성 부동산 대한민국 
5047, 무허가 유흥주점 유노윤호 광고계 손절 ,동석 이휘 종업원 총집결 재테크 장소 증권 해명 방문 여성 부동산 대한민국 
5048, 이상민 대출 알선수재 명예훼손 허위 악의적 흠집내기 ,이상민 고소인 알선수재 피소 명예훼손 소속사 검찰항고 스타잇 출판물 장진아 동일인 변제 장진아기 정보통신망법 고소한 흠집 채무 종전 악용 
5049, 불안 영혼 잠식 욕망 펜트하우스 천서진 ,천서진 청아재단 광풍 영혼 아버지 극단적 기보단 단편만 똬리 마음만 바벨탑 버티길 병리적 올라가고픈 욕망보 인간계 인정투쟁 패륜 악마적 
5050, 파주서 직원 발견 ,엘에이치 근무 경기본부 부동산금융사업관리 이본영 전북본부 전북본부장 첩보 화단 성남시 분당 자살예방 내사 유서 책임자 핫라인 직접적 우울감 간부 
5051,  장관 변창흠 청와대 인사실패 책임론 ,특수본 합동특별수사본부 노현웅 국가수사본부 뿌리 경찰청 계기 보궐선거 중심 수사 정부 
5052, 동일본대 대피소 성폭행 이슈픽 ,교토쿠마루 미야 쓰나미 어선 김채현 대조 해체 상징 잔혹사 청년 작업 
5053, 컵라면 뚜껑 전자레인지 직행하 ,전자레인지 간편식 조리 뚜껑 금속 김밥 컵라면 통조림 섭취만 유탕면 은박 조리용 용기 나트륨 전성시대 함량 기준치 주석 절반 
5054, 문재 대통령님 이성윤 검찰총장 서민 조롱 ,총장 당연직 법무부 이성윤 장관 안진 손원제 박상기 부하 지검장 위원 교수 검찰총장 노비 뽑아 중대범죄수사청법 길태 김형두 대한변호사협회장 
5055, 한번 경험 이상반응 부산의사 김원장 화제 ,김지혜 고용노동부 중수본 휴가 지방자치단체 질병관리청 중앙사고수습본부 접종자 중앙대책본부 중앙재난안전대책본부 중심 방안 방역 백신 정부 
5056, 부부 남자 불륜 은밀한 고해성사 세상밖 ,몽가야르 하나 신부 일화 고석현 웃음 고백 용서 장점 부부 관계 남성 
5057, 사태 윤석열탓 박범계 김종민 조국 고백 ,조국 검찰 정권 놀고먹었다 멍청이 순천지청장 민정비서관 변호사 강광우 문재인 김종민 취합 소관 국정원 민정수석 박범계 비서관 바보 수사권 
5058, 대피소 성폭행 폭로 만행 ,대피소 동일본대 여성 지진 성폭행 다큐멘터리 상담 희생자 담요 쓰나미 재난 핫라인 거대 남성 진술 대피소장 산리쿠 원전폭발 이와테미야 
5059, 묻지마 폭행 피범벅 편의점 직원 ,시민상 수여 용감 권남영 칭찬 친절 경찰 대처 치료 피해 남성 검토 
5060, 질타 오뚜기 중국산 미역 의혹 사과 ,미역 양재영 납품업체 수확 국내산 가공 중국산 판매 법원 중국 경찰 조사 대한민국 
5061, 내연남 남편 불일치 구미 여아 친부 미궁 ,친부 검사 남성 여아 대구과학수사연구소 경찰 반미 친엄마 불일치 내연 구미경찰 미궁 신병 여자아이 외할머니 빌라 구미 일치 친모 
5062, 제주 누구 부장 프사 염탐 ,프로필 카카오 스토리 뮤직 노출 기본 검색어로 배너 사진첩 연계 전제 음악 선호 이용자 메시지 비교 활용 
5063, 박근혜 이준석 해체 선언 예견 ,조사 임직원 박근혜 최고위원 국토교통부 필요한가 합조단 환골탈태할 불능 혁신안 정부합동조사단 직원들이 정부 심사숙고 사태 자유로울 장관 다급 결말 
5064, 유명 유튜버 광고 한번 천 구독자 무엇 ,인플루언서 광고 마케팅 크리에이터 편당 응답 유튜버 비호감 와이즈리테일 와이즈앱 호감 단가 몸값 벤츠 조사 분석서비스 트렌드모니터 나올 브랜디드 
5065, 감자튀김 음식 별점 억울 사장님 하소연 ,리뷰 냉면 별점 황당 감자튀김 로리 업주 소스 배달앱 케첩 이용자 자영업자 배달 머스타드 뿌려먹 겨자 고객 점주 악성 
5066, 유럽 백신 중단 국내 동일백신 혈전부작용 사례 ,백신 로트번호 혈전 접종 아스트라제네카 유럽 일련번호 국가 이상반응 유럽의약품청 오스트리아 추진단 생성 공급 사망 사례 여성 룩셈부르크 리투아니 
5067, 주차장 전체 도색  청구 ,범퍼 도색 교체 자동차보험 수리비 보험사 교환 과잉수리 주차 반대편 보험료 비용 수리 차주 차량 과도한 사연 사고 교체비 
5068, 국내 후배 선물한 시계 가격 ,이태양 시계 양보 고가 구단 등번호 조희찬 애착 기운 선물한 준비한 번호 선수 선배 초등학교 선물 전달 의사 미국 
5069, 배후설 이재명 지상최대 이간질 ,지사 변호사 갈등설 땅투기 사태 이재명 친문 세력 당내 더불어민주당 폭로 이낙연 당무회 대책단장 범국민대책위원회 이간 환복침투한 낭설 배후설 
5070, 전북본부장 분당 자택 국민 죄송 ,유서 범죄혐 조준혁 사망 이미경 책임자 자살 핫라인 폐쇄회로 경찰 이송 우울감 자택 극단적 부검 상담 청소년 지인 예방 
5071, 국내산 둔갑 미역 염화칼슘 오뚜기 사과 ,미역 염화칼슘 오뚜기 납품업체 중국산 납품 조희원 약품 수사 업체 사과문 가루형태 건조작업 받아챙긴 세척용 허위제보 화학회사 흐물거리 개인계좌 
5072, 최악 폭탄 하와 붕괴 우려 비상사태 ,신정연 폭우 마우이섬 주민 비상사태 하와이 흙탕물 기록적 홍수 선포 붕괴 전역 긴급 대피령 마우 빅토리노 뻘밭 차올랐 카우파칼루아 
5073, 왕세손 왕실 인종차별주의 ,왕실 인종차별주의자 부부 김정원 동생 왕자 왕세손 윌리엄 영국 문장짜리 정돕니다 핵폭탄 학교 고국 왕자비 것인가 폐지론 피부색 혼혈 
5074, 구급차 택시기사 항소심 감형 ,구급차 징역 끼어들자 이송이 형사항소 선고 양소연 결심공판 접촉사고 죗값 사설 습관 응급 주행 선처 분간 항소심 도로 반성 
5075, 구미 아이 출산 의사 확인 외할머니 내연남 검사 ,본원 불요증 알야야 검사 구미 일치 국립과학수사연구원 법원 지원 경찰 
5076, 거리두기 조정안 발표 수도권 단계 유지 가능성 ,단계 중수본 거리두기 사적모임 사적 기초자치단체 광역자치단체 논의해 조정안 세분화 확진자 디자이너 억제 전국적 중앙대책본부 중앙재난안전대책본부 격상 구조 감소 
5077, 질주 윤석열 이재명 동률 서울 충청에선 선두 ,선호도 지사 선대위원장 총장 지지층 성향 정권 전라 당선 보수층 지도 정치 교체 후보 이낙연 더불어민주당 무당층 한국갤럽 충청 
5078, 서울 아파트 전세 넉달새 급증 임대차물량 회복 ,전셋값 과도기적 계약 이사철 재계약 수석연구원 구조적 임대차 입주 상승세 급등 전세 물량 시행 신규 상승 아파트 가격 부동산 
5079, 목길이 우크라 여성 ,내분비 마르판증후군 발가락 척추측만증 평발 한기범 흉곽 관절 농구스타 티첸코바 기형 척추 운동선수 무릎 전문 관찰 손가락 질환 진료 
5080, 부부 남자 불륜 프랑스 신부들 불륜 포르노 중독 고해성사 폭로 ,신부 몽가야르 남성 하나 평등 불륜 일화 웃음 고백 만족 용서 장점 남녀 성적 부부 남편 관계 기업 여성 
5081, 주사 한가득 아파트 쓰레기장 발견 의료폐기물 ,의료폐기물 봉투 시험관 쓰레기 배출 쓰레 약병 주사 일반종량제 아파트 종량제 김초영 혈액 수거 업체 경찰 착수 배출장 해운대구청 
5082, 묻지마 폭행 피범벅 남성 편의점 직원 ,시민상 수여 용감 칭찬 경찰 대처 치료 피해 남성 검토 기업 경제 
5083, 재산 호주 억대 정부 변경 ,신공항 베저리스 크릭 예정지 연방정부 부지 농지 폭등 호주 선정 가량 기업 가격 경제 
5084, 미국서 기저질환 여성 백신 차접종 사망 ,백신 크리스텐센 아나필락시스 부검 커릴 검시관 접종했으 장현경 사망 에릭 주입 오스트리아 제약회사 알레르기 질병통제예방센터 패턴 기저질환 전신 이상반응 
5085, 고위간부 경기 분당 국민 죄송 유서 ,정년 오스트리아 본부장 유서 자살 핫라인 이송 우울감 간부 고위 극단적 부검 상담 청소년 지인 예방 생명 근무 소속 
5086, 뉴욕증시 데뷔 쿠팡 공모 상승 시총 조원 ,쿠팡 달러 뉴욕증권거래소 상장 뉴욕증시 기업 공모가인 소프트뱅크 시초 주식 태극기 거래 미국 의장 실적 게양 천만주 투자이익 파이넌스 
5087, 넷플릭스 비밀번호 공유한 시청 단속 ,넷플릭스 계정 비밀번호 시청 공유한 단속 리서치업체 매지드 정윤섭 경제전문 소유주 자신만 전송 스트리밍 오스트리아 소유자 선두 이메일 코드 
5088, 학교폭력 논란 방송 제작사들 연예 계약조건 강화 한계 ,제작사 방송사 학교폭력 드라마 박혜수 조병규 계약 보전 출연자 스트레이키즈 현진 지수 수진 손해 매니지먼트사 손실 대중문화평론가 조건 직격탄 
5089, 레깅스 민망 운동욕구 폭발 ,요가복 송해 스컬피그 모델 전문기 라이프스타 심희정 지피지 공략법 대륙 니하오 중국증시 상위 투자자 주식 
5090, 덴마크 노르웨 아이슬란드 아스트라제네카 백신 접종 일시중단 ,백신 혈전 아스트라제네카 접종 예방적 당국 오스트리아 아이슬란드 유럽 노르웨 유럽의약품청 인과관계 국가 스웨덴 영국 스페인 사례 프랑스 올리비 
5091, 국민 죄송 고위 간부 경기 분당 투신 ,김민혁 지피지 공략법 본부장 유서 대륙 니하오 중국증시 자살 핫라인 이송 우울감 상담 청소년 지인 상위 예방 생명 근무 
5092, 생후  아들 시간 방치 부부 ,납골당 박예 세심 지피지 공략법 대륙 니하오 중국증시 후회 자식 상위 반성 반복 고통 어머니 엄마 투자자 주식 병원 
5093, 그린벨트 매입 처남 보상금 차익 ,토지 보상 대토보상 처남 김승재 대지 그린벨트 김형원 투기 국민 눈높이 대통령 수용 이익 현금 건물 사태 투자 의원 
5094, 박형준 입시비 의혹 공유한 조국 멘탈 ,입시 장관 판결 동양대 서울대 가시밭길 죄목 시련 이중성 공익인권법센터 멘탈 의학전문대학원 김승현 표창장 교수 부산대 진위 법정구속 조민 
5095, 본부장 분당 유서 국민 죄송 ,부검할 전북본부 원우식 조철오 내사 신도시 사인 경찰청 착수 시신 직원 경찰 
5096, 서민 조롱 이성윤 검찰총장  이유 ,총장 당연직 법무부 이성윤 장관 안진 손원제 박상기 부하 지검장 위원 교수 검찰총장 노비 뽑아 중대범죄수사청법 길태 김형두 대한변호사협회장 
5097, 왕자 불평 왕실 재산 규모 ,왕실 파운드 공국 왕자 찰스 영국 여왕 왕세자 마클 재산 교부금 잉글랜드 부부 콘월 소유 더치 랭카스터 몬테시토 샌드링엄 
5098, 유인태 지지율 윤석열 등장 여권 선거 최대 악재 ,총장 장관 밝혀내냐 수습용 했잖 완패하다시피 정부 박광연 문재인 핍박 막론 책임론 강성 변창흠 관행 친문 재직 악재 한국토지주택공사 
5099, 조선 왕실  철퇴 진시황 암살 문구 ,화포 불랑기포 유리건판 모병 자루 명종 불랑기 서양제 세기경 탄환 파랑기 포신 프랑크 화약 자포 포르투갈인 모포 상선 이기환 
5100, 윤석열 새삼 걸레스님 인연 ,공보 총장 사퇴 본격적 외부적 전시기획사 코바나 진용 김기정 잠행 변호사 전까진 검찰총장직 정돈 김건희 대리인 계획 대신해 준비해 
5101, 구정물 배추 알몸 휘적 저질 김치 파동 ,김치 중국산 수입 수출국 채솟값 생산 식품안전 기준치 대파 안전관리 배추 이가영 검출 기생충 의무화 재료 성분 식품의약품안전처 안전성 
5102, 홍현희 학교 폭력 소리 떳떳 ,따돌림당했으 수집해놨으 홍현희 언어폭력 상습적 수년간 명예훼손 유포 게시 자제 소속사 직원 
5103, 호텔 객실 수건 변기 경고음 ,위생감독관리소 항저우시 송욱 시범 시정 점검 당국 사업 확대 현장 직원 계획 
5104, 이재용 프로포폴 투약 혐의 수사 ,아이 외할머니 친자관계 출산 친모 얽히고설킨 혈연관계 엄마 친언니 검사 수사당국 수사력 예상치 대조 성립 모녀 여아 유전자 임신 
5105, 쇠사슬 벨트 폭행 명령 ,네드 프라이스 국무부 이해관계 김영 규탄 해법 군부 채택 각국 대변 성명 실패 직원 미국 
5106,  단계 재진입 거리두기 인금지 연장 가능성 ,단계 거리두기 조정안 수도권 방역 확진자 모임금지 다중이용 지역 범위 연장 격상 감염증 신종 영업 마스크 코로나 신규 사회적 
5107, 로또 당첨 불운 방심 사망 가해자 전락 ,토팜 유로잭팟 인형 검찰 충돌 도로 레글러 불운 테디베 차량 뒤편 영국인 방심 뒷좌석 과속 부주의 행운 소용 분산 
5108, 윤정희 방치 주장 동생들 한국서 후견 지위 다툼 ,윤정희 백건우 문화계 잉꼬부부 후견 피아니스트 연주 최종적 동행 동생 지정 마스크 남편 법원 논란 백신 
5109, 오세훈 안철수 단일화 여론조사 역전 ,후보 단일화 대결 응답 범야권 집중공세 야권 국민의힘 오세훈 한국리서치 서울시장 선호도 오차범위 경선 선호 상승세 박영선 격차 국민의당 
5110, 구미 여아 친모 외할머니 의문점  ,여아 아이 친모 외할머니 친자관계 출산 친부 사망 경찰 성립 검사 소재 계획범죄 영장심사 자매지간 팔베개 바꿔치기하 남편 실질심사 
5111, 유재석 정우성 억대 비빔면 경쟁 ,비빔면 팔도비빔면 액상스프 진비빔면 한정판 소비자 드매대 별첨 별첨한 비빔소스 사들은 스타마케팅 액상비빔스프 정우성은 모델 김보경 홈쿡 토핑 더본 
5112, 동생 백신 하반신 마비 ,백신 부작용 보상 척수염 접종 정부 인과관계 우연 질병 이상반응 사례 의료업종 사촌동생 선택사항 임해주길 이상증세 이상증상 수긍 응대 
